content_id,accesslevel,contentformat,contenttype,date_added,imagedetails_heroimage,imagedetails_thumbnailimage,imagedetails_todayimage,status,type,title,director,cast,country,release_year,rating,duration,listed_in,description
ax98_fgh_60c25a6a0f2b17009f72fa5e,PAID,mp4,video,2021-07-02,image/diy/95cb3881-6cf4-482d-aa29-d5eb8f8b4694,image/diy/95cb3881-6cf4-482d-aa29-d5eb8f8b4694,image/diy/95cb3881-6cf4-482d-aa29-d5eb8f8b4694,LIVE,Movie,A Way Back Home,B. T Thomas,,,2021,TV-14,82 min,"Dramas, International Movies","After receiving a terminal diagnosis, a man fakes an accident to spare his family’s grief and must deal with the fallout of his deception."
ax98_fgh_5f39538a4ed4cd00dd9efe60,PAID,mp4,video,2021-02-06,image/diy/6c8f7edf-9189-4c71-a4de-72e52d1f3a82,image/diy/6c8f7edf-9189-4c71-a4de-72e52d1f3a82,image/diy/6c8f7edf-9189-4c71-a4de-72e52d1f3a82,RELEGATED,Movie,George Lopez: We'll Do It For Half,Troy Miller,,United States,2021,TV-MA,52 min,Stand-Up Comedy,"Comedian George Lopez tackles the future and the past of Latinx culture in America, touching on immigration, his tough relatives, aging and much more."
ax98_fgh_60d99f5155874e00a0444f2d,PAID,mp4,video,2021-09-20,image/diy/1d387b3d-84b5-4de9-976b-281075d491a1,image/diy/1d387b3d-84b5-4de9-976b-281075d491a1,image/diy/1d387b3d-84b5-4de9-976b-281075d491a1,RELEGATED,Movie,A Trash Truck Christmas,Eddie Rosas,,,2021,TV-Y,28 min,Children & Family Movies,"When Santa crash-lands in the junkyard on Christmas Eve, Hank, Trash Truck and their animal friends all have a hand in rescuing the holiday for everyone."
ax98_fgh_60bb0ace0df0a5009f44704c,PAID,mp4,video,2021-07-27,image/diy/64162e5a-c442-4e4e-b0a0-25265e234d28,image/diy/64162e5a-c442-4e4e-b0a0-25265e234d28,image/diy/64162e5a-c442-4e4e-b0a0-25265e234d28,LIVE,Movie,One Like It,Marwan Nabil,,Egypt,2021,TV-G,15 min,"Dramas, Independent Movies, International Movies",This short film follows a day in the life of a young woman in Egypt and how her interactions with others expose long-standing stereotypes and biases.
ax98_fgh_5f4b758d46762300e48fe3c7,FREE,mp4,video,2021-04-09,image/diy/658e9ada-c5d9-46f5-80f4-655c186d4401,image/diy/658e9ada-c5d9-46f5-80f4-655c186d4401,image/diy/658e9ada-c5d9-46f5-80f4-655c186d4401,LIVE,Movie,Namaste Wahala,Hamisha Daryani Ahuja,,Nigeria,2021,TV-14,107 min,"Comedies, Dramas, International Movies",An interracial romance hits humorous and heart-wrenching hiccups as the couple's parents fight tooth and nail against their relationship.
ax98_fgh_6060d1de5c7fd800a6d6ee7f,PAID,mp4,video,2021-05-07,image/diy/dc7e94f2-3ee9-4408-9842-0fe82540caae,image/diy/dc7e94f2-3ee9-4408-9842-0fe82540caae,image/diy/dc7e94f2-3ee9-4408-9842-0fe82540caae,LIVE,Movie,Dark Forces,Bernardo Arellano,,Mexico,2021,TV-MA,81 min,"Horror Movies, Independent Movies, International Movies","In search of his sister, a renegade criminal seeks answers at a sordid hotel where he encounters a sinister guest and romances a mysterious waitress."
ax98_fgh_609629d021da7800adb21901,FREE,mp4,video,2021-05-10,image/diy/110dc62e-6851-4f30-b0fe-1b86ab6c7298,image/diy/110dc62e-6851-4f30-b0fe-1b86ab6c7298,image/diy/110dc62e-6851-4f30-b0fe-1b86ab6c7298,RELEGATED,Movie,Tigertail,Alan Yang,,United States,2021,PG,91 min,Dramas,A man reflects on the lost love of his youth and his long-ago journey from Taiwan to America as he begins to reconnect with his estranged daughter.
ax98_fgh_605d8966bb814400df25355f,PAID,mp4,video,2021-03-29,image/diy/6be87ff9-f8c2-4a39-81bf-4892567678c8,image/diy/6be87ff9-f8c2-4a39-81bf-4892567678c8,image/diy/6be87ff9-f8c2-4a39-81bf-4892567678c8,RELEGATED,Movie,The Magic School Bus Rides Again Kids In Space,Richard Weston,,United States,2021,TV-Y,46 min,Children & Family Movies,The Magic School Bus kids blast into orbit — and onto the International Space Station — only to find themselves on the run from a giant tardigrade!
ax98_fgh_5f7c70ecc2db7b00f9972f85,PAID,mp4,video,2021-01-26,image/diy/1ea3a20f-0a92-4a75-ab07-3d54cda4ad05,image/diy/1ea3a20f-0a92-4a75-ab07-3d54cda4ad05,image/diy/1ea3a20f-0a92-4a75-ab07-3d54cda4ad05,LIVE,Movie,Sniper: Ghost Shooter,Don Michael Paul,,United States,2016,R,99 min,Action & Adventure,Snipers ordered to protect a gas pipeline from terrorists suspect a security breach when they're targeted by a ghost shooter who knows their location.
ax98_fgh_60784132ddc0150c8471b7df,PAID,mp4,video,2021-05-07,image/diy/305cc2d3-6699-4123-af90-fff47d769d73,image/diy/305cc2d3-6699-4123-af90-fff47d769d73,image/diy/305cc2d3-6699-4123-af90-fff47d769d73,RELEGATED,Movie,The Vault,Jaume Balagueró,,,2021,R,118 min,"Action & Adventure, International Movies, Thrillers",A genius engineer and his crew of amateur thieves plot a scheme to seize a legendary lost treasure hidden in a fortress beneath the Bank of Spain.
ax98_fgh_60d9add8cb219200a783f6c4,PAID,mp4,video,2021-08-22,image/diy/33dc2610-275a-4296-b7a6-5d9a991d4235,image/diy/33dc2610-275a-4296-b7a6-5d9a991d4235,image/diy/33dc2610-275a-4296-b7a6-5d9a991d4235,RELEGATED,Movie,Day of Destiny,"Akay Mason, Abosi Ogba",,,2021,TV-PG,110 min,"Children & Family Movies, Dramas, International Movies","With their family facing financial woes, two teen brothers seize an opportunity to reverse their bad fortunes by traveling 20 years back in time."
ax98_fgh_6186e4a67df58b009809a1d3,PAID,mp4,video,2021-11-10,image/diy/101821cb-03dd-4b50-b8ef-f16486e36bf7,image/diy/101821cb-03dd-4b50-b8ef-f16486e36bf7,image/diy/101821cb-03dd-4b50-b8ef-f16486e36bf7,LIVE,Movie,Milestone,Ivan Ayr,,India,2021,TV-14,98 min,"Dramas, Independent Movies, International Movies","Recently marking 500,000 kilometers on the road, a newly bereaved trucker faces the threat of losing the job that has come to define him to a new intern."
ax98_fgh_5ed79395970c4600ca9bb19d,PAID,mp4,video,2021-02-04,image/diy/374c5913-c5f3-42c7-a5c3-4ed05d039149,image/diy/374c5913-c5f3-42c7-a5c3-4ed05d039149,image/diy/374c5913-c5f3-42c7-a5c3-4ed05d039149,LIVE,Movie,Barbie Big City Big Dreams,Scott Pleydell-Pearce,,,2021,TV-Y,63 min,"Children & Family Movies, Music & Musicals","At a summer performing arts program in New York City, Barbie from Malibu meets Barbie from Brooklyn, and the two become fast friends."
ax98_fgh_60119ff631902b00b5bd1b41,PAID,mp4,video,2021-02-01,image/diy/b689398e-757b-4663-a687-9c371c86366f,image/diy/b689398e-757b-4663-a687-9c371c86366f,image/diy/b689398e-757b-4663-a687-9c371c86366f,LIVE,Movie,London Hughes: To Catch a D*ck,Kristian Mercado,,United States,2021,TV-MA,68 min,Stand-Up Comedy,Bawdy comedian and television presenter London Hughes revisits her past in this acclaimed breakout special filled with unfiltered tales and wild stories.
ax98_fgh_609ac4f9f12c1600d13ba0aa,PAID,mp4,video,2021-05-14,image/diy/fc031d35-73cf-44cc-85e7-466a9e2d71d1,image/diy/22c10d3c-9c5a-456a-ae49-fd26b47ea6e5,image/diy/c6920e6f-149d-4c09-a9ce-b77cbf62f24e,LIVE,Movie,Milkwater,Morgan Ingari,,United States,2021,TV-MA,102 min,"Comedies, Dramas, Independent Movies",Aimless 20-something Milo impulsively becomes a gay man’s surrogate and wrestles with the emotional complexities of her non-traditional decision.
ax98_fgh_6022d06582ccba00de34fe7b,PAID,mp4,video,2021-05-05,image/diy/423d77c8-76dd-4496-b060-f9889cc96868,image/diy/423d77c8-76dd-4496-b060-f9889cc96868,image/diy/423d77c8-76dd-4496-b060-f9889cc96868,LIVE,Movie,My Amanda,Alessandra de Rossi,,,2021,TV-14,90 min,"Dramas, International Movies, Romantic Movies","Two unusually close friends share every aspect of their lives together. As their lives evolve, their bond remains the only constant."
ax98_fgh_614e3d31afddfd009888f01e,PAID,mp4,video,2021-09-28,image/diy/008e55c0-c3f1-4594-82e0-234d0d1c8c7f,image/diy/008e55c0-c3f1-4594-82e0-234d0d1c8c7f,image/diy/008e55c0-c3f1-4594-82e0-234d0d1c8c7f,LIVE,Movie,And Tomorrow the Entire World,Julia von Heinz,,"Germany, France",2021,TV-MA,112 min,"Dramas, International Movies, Thrillers",A law student joins an anti-fascist group and finds herself sucked into increasingly dangerous situations and drawn more and more to violence.
ax98_fgh_5fa5347d84ab5100acc6e888,PAID,mp4,video,2021-04-09,image/diy/a07760d6-7d29-4102-8334-448a8e75febd,image/diy/a07760d6-7d29-4102-8334-448a8e75febd,image/diy/a07760d6-7d29-4102-8334-448a8e75febd,LIVE,Movie,Aziza,Soudade Kaadan,,"Lebanon, Syria",2019,TV-PG,13 min,"Comedies, Dramas, Independent Movies","This short film follows a newly displaced Syrian couple's drive around Beirut, which then morphs into a hallucinatory and nostalgic trip."
ax98_fgh_60992ffcd3080300c9872521,PAID,mp4,video,2021-08-19,image/diy/9270fe1a-e37f-4b99-8f05-cc606584e3dc,image/diy/9270fe1a-e37f-4b99-8f05-cc606584e3dc,image/diy/9270fe1a-e37f-4b99-8f05-cc606584e3dc,LIVE,Movie,The Larva Island Movie,Ahn Byoung-wook,,South Korea,2021,TV-Y7,91 min,"Children & Family Movies, Comedies","In this movie sequel to the hit series, Chuck returns home and talks to a reporter about life on the island with zany larva pals Red and Yellow."
ax98_fgh_6086e6184501ac00fb3f8c26,PAID,mp4,video,2021-05-05,image/diy/ae2b3cbf-02bb-403c-99a4-258ba23e4910,image/diy/ae2b3cbf-02bb-403c-99a4-258ba23e4910,image/diy/ae2b3cbf-02bb-403c-99a4-258ba23e4910,LIVE,Movie,Snow Day,Chris Koch,,United States,2000,PG,89 min,"Children & Family Movies, Comedies","When a snow day shuts down the whole town, the Wheeler family cuts loose. Hal makes a play for the most popular girl in his school, 10-year-old Natalie takes on the dreaded snowplow man, and Dad gets into a showdown with a rival meteorologist."
ax98_fgh_607ef4dafa3e3300c3ce97e5,PAID,mp4,video,2021-05-05,image/diy/38b74486-92db-4191-a185-82fac2595a02,image/diy/38b74486-92db-4191-a185-82fac2595a02,image/diy/38b74486-92db-4191-a185-82fac2595a02,LIVE,Movie,Underworld,Len Wiseman,,"United States, United Kingdom, Germany, Hungary",2003,R,121 min,"Action & Adventure, Horror Movies, Sci-Fi & Fantasy",A vampire warrior begins to question her mission in the ancient war between the undead and werewolves when she falls for a human under her protection.
ax98_fgh_5ef38706fec56300b4e43ec9,PAID,mp4,video,2021-02-04,image/diy/13017a5b-e51b-495c-bd4a-f2a652450f2c,image/diy/13017a5b-e51b-495c-bd4a-f2a652450f2c,image/diy/13017a5b-e51b-495c-bd4a-f2a652450f2c,LIVE,Movie,Taare Zameen Par,Aamir Khan,,India,2007,PG,162 min,"Dramas, International Movies","When daydreamer Ishaan is sent to boarding school, an unconventional art teacher tries to help the imaginative student discover his true identity."
ax98_fgh_614226289cb70e00b431772f,PAID,mp4,video,2021-09-25,image/diy/fe0483bc-110d-4526-b634-0a972b07ae99,image/diy/fe0483bc-110d-4526-b634-0a972b07ae99,image/diy/fe0483bc-110d-4526-b634-0a972b07ae99,LIVE,Movie,The Princess Switch: Switched Again,Mike Rohl,,United States,2021,TV-G,97 min,"Children & Family Movies, Comedies, Dramas","When Margaret's Christmas coronation complicates her love life, her double Stacy steps in to save the day. But will a third look-alike ruin their plan?"
ax98_fgh_612b37835fc297009febcfbb,PAID,mp4,video,2021-09-04,image/diy/d28f23d1-166c-4149-8e26-e5aa48dac8ad,image/diy/d28f23d1-166c-4149-8e26-e5aa48dac8ad,image/diy/d28f23d1-166c-4149-8e26-e5aa48dac8ad,LIVE,Movie,Rhys Nicholson Live at the Athenaeum,Thomas Toby Parkinson,,United Kingdom,2021,TV-MA,66 min,Stand-Up Comedy,"Rhys Nicholson flexes his biting humor as he discusses horse tranquilizers, angry letters from viewers, and more in this stand-up special."
ax98_fgh_5fe0d7cdfbad0c00fa6b726c,FREE,mp4,video,2021-02-06,image/diy/deebd675-4abc-4f04-bfa2-1b9859c804b8,image/diy/deebd675-4abc-4f04-bfa2-1b9859c804b8,image/diy/deebd675-4abc-4f04-bfa2-1b9859c804b8,RELEGATED,Movie,Working Title,Mary Harron,,,2019,R,110 min,Dramas,"In the '70s, a graduate student works with three incarcerated women from the Manson Family as they look back at their lives. Based on a true story."
ax98_fgh_60bf61b43965330092dd8458,PAID,mp4,video,2021-08-27,image/diy/299b01d9-64e0-4cd6-ab6e-3455ff8c717a,image/diy/299b01d9-64e0-4cd6-ab6e-3455ff8c717a,image/diy/299b01d9-64e0-4cd6-ab6e-3455ff8c717a,LIVE,Movie,Rogue City,Olivier Marchal,,France,2021,TV-MA,116 min,"Dramas, International Movies, Thrillers","Caught in the crosshairs of police corruption and Marseille’s warring gangs, a loyal cop must protect his squad by taking matters into his own hands."
ax98_fgh_5f8f081f4d9e1b0091dac1d2,FREE,mp4,video,2021-02-06,image/diy/caf6f066-f3da-40b0-97f2-c88ae02e71ae,image/diy/caf6f066-f3da-40b0-97f2-c88ae02e71ae,image/diy/caf6f066-f3da-40b0-97f2-c88ae02e71ae,LIVE,Movie,Tragic Jungle,Yulene Olaizola,,"Mexico, France, Colombia",2021,TV-MA,97 min,"Dramas, Independent Movies, International Movies","To escape an arranged marriage, a woman flees into the depths of the Mayan jungle, where untamed nature merges the human and the supernatural."
ax98_fgh_6039b37ea2c55500f39b7801,FREE,mp4,video,2021-03-03,image/diy/026a608c-d7c8-4caf-8d9c-33efb7ba2dc7,image/diy/026a608c-d7c8-4caf-8d9c-33efb7ba2dc7,image/diy/026a608c-d7c8-4caf-8d9c-33efb7ba2dc7,LIVE,Movie,Wave of Cinema: One Day We'll Talk About Today,Adriano Rudiman,,,2021,TV-14,71 min,"Documentaries, International Movies, Music & Musicals","Delve into a musical concert and relive moments from ""One Day We'll Talk About Today,"" a film about family and intergenerational trauma."
ax98_fgh_61ab3a975a1dfa00a6e8613c,PAID,mp4,video,2021-12-12,image/diy/f896dc89-4088-45f3-9eb1-12dde965b13f,image/diy/f896dc89-4088-45f3-9eb1-12dde965b13f,image/diy/f896dc89-4088-45f3-9eb1-12dde965b13f,RELEGATED,Movie,Initial D,"Andrew Lau Wai-keung, Alan Mak",,"China, Hong Kong",2005,TV-14,109 min,"Action & Adventure, International Movies","By day, an 18-year-old delivers tofu for his father, a retired race car driver; but by night, it's the teen's turn to take the wheel."
ax98_fgh_6049ad1b65afab00c3a2dd2d,FREE,mp4,video,2021-03-16,image/diy/62f4a6a7-d72f-4bdb-ae36-4856eae266c1,image/diy/62f4a6a7-d72f-4bdb-ae36-4856eae266c1,image/diy/62f4a6a7-d72f-4bdb-ae36-4856eae266c1,LIVE,Movie,Confusion Na Wa,Kenneth Gyang,,Nigeria,2013,TV-MA,106 min,"Comedies, Dramas, International Movies",A misplaced cell phone's incriminating content becomes a prime blackmail opportunity for a pair of petty thieves who soon regret their greedy scheme.
ax98_fgh_60d315d29ccea600d7ea094f,PAID,mp4,video,2021-09-11,image/diy/6a3b641a-38c5-42ef-9926-e26c4aab4dbe,image/diy/6a3b641a-38c5-42ef-9926-e26c4aab4dbe,image/diy/6a3b641a-38c5-42ef-9926-e26c4aab4dbe,RELEGATED,Movie,Lokillo: Nothing's the Same,Julián Gaviria,,Colombia,2021,TV-MA,64 min,Stand-Up Comedy,"Through songs and puns, comedian Lokillo Florez hilariously reviews how Latin Americans have adjusted to a new world where no-hugging policies prevail."
ax98_fgh_60a8fb5c9c467f00926b8bf0,PAID,mp4,video,2021-05-24,image/diy/1af46c02-3966-4bc0-b191-4591c9fd6fdd,image/diy/3ad5eeed-6236-45bf-a52a-fc65bbe9d73d,image/diy/6e5f38c8-1e9a-48fc-b14c-bdbc6fb4e947,LIVE,Movie,"Sí, Mi Amor",Pedro Flores Maldonado,,,2021,TV-MA,107 min,"Comedies, International Movies, Romantic Movies",A blindsided boyfriend must prove his fidelity when his girlfriend spontaneously dumps him after suspecting him of cheating.
ax98_fgh_60525583a5f31c00c9cb38e0,PAID,mp4,video,2021-03-29,image/diy/e44d96ed-d73e-4d76-b520-e1599ace35a6,image/diy/e44d96ed-d73e-4d76-b520-e1599ace35a6,image/diy/e44d96ed-d73e-4d76-b520-e1599ace35a6,RELEGATED,Movie,Hell Fest,Gregory Plotkin,,United States,2018,R,89 min,Horror Movies,"A serial killer picks off a group of friends, one by one, as they make their way through a hell-themed amusement park."
ax98_fgh_60ead3fd9bff8400a0eeba7a,PAID,mp4,video,2021-08-10,image/diy/8fbbed5b-37b2-458a-8cd0-775ad5ef1f59,image/diy/8fbbed5b-37b2-458a-8cd0-775ad5ef1f59,image/diy/8fbbed5b-37b2-458a-8cd0-775ad5ef1f59,LIVE,Movie,Chris Rock Total Blackout: The Tamborine Extended Cut,Chris Rock,,,2021,TV-MA,98 min,Stand-Up Comedy,"In this extended cut of his 2018 special, Chris Rock takes the stage for a special filled with searing observations on fatherhood, infidelity and politics."
ax98_fgh_6072775f0c590e00d87f4b2a,PAID,mp4,video,2021-05-07,image/diy/a6f1b8db-a788-438e-a3a3-0fcc1f203d61,image/diy/a6f1b8db-a788-438e-a3a3-0fcc1f203d61,image/diy/a6f1b8db-a788-438e-a3a3-0fcc1f203d61,DRAFT,Movie,Just In Time,Dolapo Adeleke,,Kenya,2021,TV-G,92 min,"Comedies, Dramas, International Movies",A meticulous clerk for a bookstore that has just been shuttered suddenly finds herself taking care of her cousin's witty 11-year-old daughter.
ax98_fgh_60bb718e17c44700920cea43,PAID,mp4,video,2021-06-15,image/diy/dfad525d-555c-4157-a958-100889528629,image/diy/dfad525d-555c-4157-a958-100889528629,image/diy/dfad525d-555c-4157-a958-100889528629,LIVE,Movie,Love,Khalid Rahman,,India,2021,TV-14,91 min,"Dramas, Independent Movies, International Movies",The troubling inner workings of a toxic marriage reveal themselves in surprising ways after one of the couple’s feuds spins out of control.
ax98_fgh_60712a695540c200de25c337,PAID,mp4,video,2021-05-07,image/diy/56fd5d83-f667-4d49-a182-fb255aa5bda3,image/diy/56fd5d83-f667-4d49-a182-fb255aa5bda3,image/diy/56fd5d83-f667-4d49-a182-fb255aa5bda3,LIVE,Movie,"Love, Guaranteed",Mark Steven Johnson,,United States,2021,TV-PG,91 min,"Comedies, Independent Movies, Romantic Movies",Sparks fly when a crusading but cash-strapped attorney takes on a charming client looking to sue a dating site that guarantees its users will find love.
ax98_fgh_604a2a66dfbd4000b41ad329,PAID,mp4,video,2021-05-05,image/diy/8ba33b3f-5ab9-4be7-bd83-4228d656905a,image/diy/8ba33b3f-5ab9-4be7-bd83-4228d656905a,image/diy/8ba33b3f-5ab9-4be7-bd83-4228d656905a,LIVE,Movie,Alan Saldaña: Locked Up,Alex Díaz,,Mexico,2021,TV-MA,49 min,Stand-Up Comedy,"Mexican comedian Alan Saldaña is back, poking gentle fun at himself and parceling advice, especially about how to stay married and how to be parents."
ax98_fgh_603a89ca82647e00ec32ec97,PAID,mp4,video,2021-05-07,image/diy/25ba7dd2-ac2b-440f-92bd-587014a1744f,image/diy/25ba7dd2-ac2b-440f-92bd-587014a1744f,image/diy/25ba7dd2-ac2b-440f-92bd-587014a1744f,RELEGATED,Movie,Hating Peter Tatchell,Christopher Amos,,Australia,2021,TV-MA,91 min,"Documentaries, International Movies, LGBTQ Movies",This documentary follows gay rights activist Peter Tatchell from his early life to his fight for justice amid controversy and political turmoil.
ax98_fgh_61bf644cefc7f800b421e344,PAID,mp4,video,2021-12-23,image/diy/45a15cab-d071-4c26-9f3a-7edcc50571dd,image/diy/45a15cab-d071-4c26-9f3a-7edcc50571dd,image/diy/45a15cab-d071-4c26-9f3a-7edcc50571dd,DRAFT,Movie,Roped,Shaun Paul Piccinino,,United States,2021,PG,90 min,"Children & Family Movies, Dramas, Romantic Movies",A star cowboy in a traveling rodeo gets thrown off course when he falls in love with the daughter of a tough-minded town councilman.
ax98_fgh_61ca17c948a4ec00ca0c18ac,PAID,mp4,video,2021-12-30,image/diy/486217cf-504b-4829-8bfe-a31fc0f37d5f,image/diy/486217cf-504b-4829-8bfe-a31fc0f37d5f,image/diy/486217cf-504b-4829-8bfe-a31fc0f37d5f,DRAFT,Movie,The Twilight Saga: Eclipse,David Slade,,United States,2010,PG-13,124 min,"Dramas, Romantic Movies","With a bloodthirsty enemy on a quest for revenge, Bella must reconcile her love for vampire Edward and her growing feelings for werewolf Jacob."
ax98_fgh_5fc866e03e868600f9445931,PAID,mp4,video,2021-02-09,image/diy/c88c4387-fc7a-47ee-bd1f-ae2963190fef,image/diy/c88c4387-fc7a-47ee-bd1f-ae2963190fef,image/diy/c88c4387-fc7a-47ee-bd1f-ae2963190fef,LIVE,Movie,Million Dollar Baby,Clint Eastwood,,United States,2004,PG-13,133 min,"Dramas, Sports Movies","When a cantankerous trainer mentors a persistent amateur boxer determined to go pro, deep-seated emotions become their strongest opponents."
ax98_fgh_5fb1745b108e0600ce29fd62,PAID,mp4,video,2021-05-07,image/diy/7802428c-6102-4210-b2f3-33ad58869052,image/diy/7802428c-6102-4210-b2f3-33ad58869052,image/diy/7802428c-6102-4210-b2f3-33ad58869052,LIVE,Movie,Rust Creek,Jen McGowan,,United States,2018,R,108 min,Thrillers,A wrong turn in the woods becomes a fight for her life when a career-seeking college student runs into two outlaw brothers looking to cook up trouble.
ax98_fgh_5f9142da5b350100eb882a84,PAID,mp4,video,2021-05-31,image/diy/24835f12-bab9-4caf-8958-5d9f9d315023,image/diy/24835f12-bab9-4caf-8958-5d9f9d315023,image/diy/24835f12-bab9-4caf-8958-5d9f9d315023,RELEGATED,Movie,Thimmarusu,Sharan Koppisetty,,India,2021,TV-14,125 min,"Dramas, International Movies","Eight years after a young man is framed for murder, an up-and-coming lawyer re-opens the case, beginning a tricky mission to find the real culprit."
ax98_fgh_61082a0b4debec00d02491cc,PAID,mp4,video,2021-09-06,image/diy/2b590f30-a2a3-41ac-89a1-fd2abacc0166,image/diy/2b590f30-a2a3-41ac-89a1-fd2abacc0166,image/diy/2b590f30-a2a3-41ac-89a1-fd2abacc0166,LIVE,Movie,Memories of a Teenager,Lucas Santa Ana,,Argentina,2019,TV-MA,97 min,"Dramas, International Movies, LGBTQ Movies","To cope with a friend's death, a teen blogs about his daily life but falls further into an existential crisis while experiencing a sexual awakening."
ax98_fgh_5ff34f2b32b8c74af8fb3781,PAID,mp4,video,2021-05-07,image/diy/861f1001-d3a6-4fb4-8683-98d7b216eaec,image/diy/861f1001-d3a6-4fb4-8683-98d7b216eaec,image/diy/861f1001-d3a6-4fb4-8683-98d7b216eaec,RELEGATED,Movie,Chico Bon Bon and the Very Berry Holiday,Darragh O'Connell,,,2021,TV-Y,25 min,Children & Family Movies,"The Fix-It Force makes a plan to hit every home as fast as they can, delivering Blunderberry Cakes before the town awakes to avoid a holiday disaster."
ax98_fgh_602266527fb02e00b4ed67d7,PAID,mp4,video,2021-02-12,image/diy/bf3986e3-eff8-456e-a1e5-5e7a7b2c31ff,image/diy/bf3986e3-eff8-456e-a1e5-5e7a7b2c31ff,image/diy/bf3986e3-eff8-456e-a1e5-5e7a7b2c31ff,LIVE,Movie,American Pie 9: Girls' Rules,Mike Elliott,,United States,2021,R,96 min,Comedies,Four tight-knit high school seniors vow to turn their love lives around by homecoming when the arrival of a new student muddles their plans.
ax98_fgh_60d0cc31aeb89300bc0af68a,PAID,mp4,video,2021-06-24,image/diy/a63f6a3c-b800-4bb8-9058-677a6005f9ec,image/diy/a63f6a3c-b800-4bb8-9058-677a6005f9ec,image/diy/a63f6a3c-b800-4bb8-9058-677a6005f9ec,LIVE,Movie,Death of Me,Darren Lynn Bousman,,"United States, Thailand",2021,R,94 min,Horror Movies,"With no memory of the previous night, a vacationing couple uncovers a disturbing personal video that inexplicably shows one of them killing the other."
ax98_fgh_608670f12d816400c9050c7f,PAID,mp4,video,2021-05-05,image/diy/ee41ecbd-b281-496a-83d6-8902f2c5e996,image/diy/ee41ecbd-b281-496a-83d6-8902f2c5e996,image/diy/ee41ecbd-b281-496a-83d6-8902f2c5e996,RELEGATED,Movie,99 Songs (Tamil),,,,2021,TV-14,131 min,"Dramas, International Movies, Music & Musicals","Challenged to compose 100 songs before he can marry the girl he loves, a tortured but passionate singer-songwriter embarks on a poignant musical journey."
ax98_fgh_60080e815d8b4100ee420778,PAID,mp4,video,2021-01-23,image/diy/d8693a74-c315-4c82-a2ad-3485f658506f,image/diy/d8693a74-c315-4c82-a2ad-3485f658506f,image/diy/d8693a74-c315-4c82-a2ad-3485f658506f,LIVE,Movie,Alien Xmas,Stephen Chiodo,,United States,2021,TV-Y,42 min,Children & Family Movies,"A young elf mistakes a tiny alien for a Christmas gift, not knowing her new plaything has plans to destroy Earth's gravity — and steal all the presents."
ax98_fgh_6129c1964dad1000d3815a76,PAID,mp4,video,2021-08-31,image/diy/55d5e83a-2450-491a-a849-6cf70bf30f30,image/diy/55d5e83a-2450-491a-a849-6cf70bf30f30,image/diy/55d5e83a-2450-491a-a849-6cf70bf30f30,LIVE,Movie,Coded Bias,Shalini Kantayya,,"United States, China, United Kingdom",2021,TV-MA,86 min,Documentaries,This documentary investigates the bias in algorithms after M.I.T. Media Lab researcher Joy Buolamwini uncovered flaws in facial recognition technology.
ax98_fgh_6123c60852dcc900a97bb064,PAID,mp4,video,2021-08-26,image/diy/87d6494e-a9a0-4c2c-b663-3a2857729465,image/diy/87d6494e-a9a0-4c2c-b663-3a2857729465,image/diy/87d6494e-a9a0-4c2c-b663-3a2857729465,LIVE,Movie,Not Another Teen Movie,Joel Gallen,,United States,2001,R,89 min,Comedies,"On a bet, a gridiron hero at John Hughes High School sets out to turn a bespectacled artist into a prom queen in this outrageous parody."
ax98_fgh_6128d504ebe40e00a19cde43,PAID,mp4,video,2021-09-03,image/diy/49620526-dfff-4f85-be8f-ea2b5b095607,image/diy/49620526-dfff-4f85-be8f-ea2b5b095607,image/diy/49620526-dfff-4f85-be8f-ea2b5b095607,LIVE,Movie,Cradle 2 the Grave,Andrzej Bartkowiak,,United States,2003,R,101 min,Action & Adventure,"When a jewel thief pulls off a risky diamond heist with his crew, a gang kidnaps his young daughter and steals the loot as a rival agent offers his help."
ax98_fgh_5f9140a382256e00b48db419,PAID,mp4,video,2021-05-31,image/diy/28f6a61b-5b29-4fa9-b721-7071b0942348,image/diy/28f6a61b-5b29-4fa9-b721-7071b0942348,image/diy/28f6a61b-5b29-4fa9-b721-7071b0942348,RELEGATED,Movie,Back to Q82,Ahmed Siddiqui,,"Kuwait, United States",2017,TV-14,104 min,"Comedies, International Movies","Eager to rejoin her divorced parents, an inventor's daughter drives his time-traveling car back to 1982. But a secret crush accidentally follows."
ax98_fgh_5f1463af535f2400919c915c,PAID,mp4,video,2021-02-04,image/diy/78490f27-6e5d-427e-be2f-1942a0ee07b7,image/diy/78490f27-6e5d-427e-be2f-1942a0ee07b7,image/diy/78490f27-6e5d-427e-be2f-1942a0ee07b7,LIVE,Movie,The White Tiger,Ramin Bahrani,,"India, United States",2021,R,127 min,Dramas,The ambitious driver for a rich Indian family uses his wit and cunning to escape from poverty and become an entrepreneur. Based on the bestselling novel.
