content_id,accesslevel,contentformat,contenttype,date_added,imagedetails_heroimage,imagedetails_thumbnailimage,imagedetails_todayimage,status,type,title,director,cast,country,release_year,rating,duration,listed_in,description
ax98_fgh_61351802eccd59009845c904,PAID,mp4,video,2021-09-08,image/diy/7269687c-d847-420a-b940-3b7a92ab2173,image/diy/7269687c-d847-420a-b940-3b7a92ab2173,image/diy/7269687c-d847-420a-b940-3b7a92ab2173,LIVE,Movie,Tony Parker: The Final Shot,Florent Bodin,Tony Parker,France,2021,TV-14,99 min,"Documentaries, International Movies, Sports Movies","This film examines the background and career of Tony Parker, whose determination led him to become arguably the greatest French basketball player."
ax98_fgh_60f3ec2b9063a6009287df37,PAID,mp4,video,2021-09-01,image/diy/854330aa-e103-4a85-adad-9a3893700060,image/diy/854330aa-e103-4a85-adad-9a3893700060,image/diy/854330aa-e103-4a85-adad-9a3893700060,LIVE,Movie,Sitara: Let Girls Dream,Sharmeen Obaid-Chinoy,,"Pakistan, United States",2021,TV-PG,16 min,"Children & Family Movies, Dramas","In this silent short set in 1970s Pakistan, 14-year-old Pari longs to be a pilot, unaware that her father plans to marry her off to a much older man."
ax98_fgh_5f54e9cbbf0e040091e39bc2,FREE,mp4,video,2021-04-09,image/diy/4d0cd190-84ec-4d58-ab84-14e109319476,image/diy/4d0cd190-84ec-4d58-ab84-14e109319476,image/diy/4d0cd190-84ec-4d58-ab84-14e109319476,LIVE,Movie,The Tour,Juraj Šajmovič,"Miloš Knor, Lukáš Pavlásek, Tomáš Matonoha, Ester Kočičková, Michal Kavalčík, Richard Nedvěd",,2016,TV-MA,93 min,"Comedies, Documentaries, International Movies","Miloš Knor brings comedians Lukáš Pavlásek, Tomáš Matonoha, Ester Kočičková, Michal Kavalčík and Richard Nedvěd on a tour around the Czech Republic."
ax98_fgh_61add4a8aad12e00c95168c5,PAID,mp4,video,2021-12-23,image/diy/dc7d23a5-0092-4972-9784-8d16052aee77,image/diy/dc7d23a5-0092-4972-9784-8d16052aee77,image/diy/dc7d23a5-0092-4972-9784-8d16052aee77,RELEGATED,Movie,Untold: Breaking Point,"Chapman Way, Maclain Way",,United States,2021,TV-MA,80 min,"Documentaries, Sports Movies","Under pressure to continue a winning tradition in American tennis, Mardy Fish faced mental health challenges that changed his life on and off the court."
ax98_fgh_5f2865c40e3d6200ec3bad19,PAID,mp4,video,2021-02-24,image/diy/8657355f-bc84-4acf-aa8b-299e97cdb3b0,image/diy/8657355f-bc84-4acf-aa8b-299e97cdb3b0,image/diy/8657355f-bc84-4acf-aa8b-299e97cdb3b0,LIVE,Movie,Friendsgiving,Nicol Paone,"Malin Akerman, Kat Dennings, Aisha Tyler, Jane Seymour, Jack Donnelly, Chelsea Peretti, Christine Taylor, Ryan Hansen, Deon Cole, Wanda Sykes",United States,2021,R,95 min,Comedies,A quiet holiday dinner among friends turns into a chaotic night of illicit activity and compromising situations when uninvited guests crash the party.
ax98_fgh_6112f10083ccd700a745733f,PAID,mp4,video,2021-08-18,image/diy/47182967-3032-40a3-9333-8c8ac278c941,image/diy/47182967-3032-40a3-9333-8c8ac278c941,image/diy/47182967-3032-40a3-9333-8c8ac278c941,LIVE,Movie,Dolly Parton’s Christmas on the Square,Debbie Allen,"Dolly Parton, Christine Baranski, Treat Williams, Jenifer Lewis, Josh Segarra, Jeanine Mason, Mary Lane Haskell",United States,2021,TV-PG,99 min,"Children & Family Movies, Music & Musicals","Seasonal cheer comes to a screeching halt when a cold-hearted woman tries to sell her hometown's land. Can music, magic and memories change her mind?"
ax98_fgh_60eacdb6ba998500a7f98936,PAID,mp4,video,2021-09-06,image/diy/03e96886-10fa-40db-aa55-f9360ae902a3,image/diy/03e96886-10fa-40db-aa55-f9360ae902a3,image/diy/03e96886-10fa-40db-aa55-f9360ae902a3,LIVE,Movie,Bert Kreischer: Hey Big Boy,Jeff Tomsic,Bert Kreischer,United States,2021,TV-MA,62 min,Stand-Up Comedy,"Ever the stand-up party animal, comic Bert Kreischer riffs on parenting and family life, being a gun and pet owner, his dad discovering pot, and more."
ax98_fgh_615ead90ee99a200ad6530ae,PAID,mp4,video,2021-10-09,image/diy/be8226d4-98cd-4d70-bb8b-b33b5ad83ba4,image/diy/be8226d4-98cd-4d70-bb8b-b33b5ad83ba4,image/diy/be8226d4-98cd-4d70-bb8b-b33b5ad83ba4,RELEGATED,Movie,Brick Mansions,Camille Delamarre,"Paul Walker, David Belle, RZA, Gouchy Boy, Catalina Denis, Ayisha Issa, Carlo Rota, Andreas Apergis, Richard Zeman, Robert Maillet","France, Canada, United States, Spain",2014,PG-13,90 min,"Action & Adventure, International Movies",An undercover police detective partners with an ex-convict to take down a drug kingpin amid grime and crime in a walled-off Detroit housing project.
ax98_fgh_613da9b42c5f8e00c2d404f2,PAID,mp4,video,2021-09-18,image/diy/1387bf38-c363-443b-8039-b63b62df1f9e,image/diy/1387bf38-c363-443b-8039-b63b62df1f9e,image/diy/1387bf38-c363-443b-8039-b63b62df1f9e,LIVE,Movie,You vs. Wild: Out Cold,Ben Simms,"Bear Grylls, Jason Derek Prempeh",,2021,TV-G,106 min,Children & Family Movies,"After a plane crash leaves Bear with amnesia, he must make choices to save the missing pilot and survive in this high-stakes interactive adventure."
ax98_fgh_6166bc54197c8d00a75f65fc,PAID,mp4,video,2021-10-21,image/diy/c1e7a004-292f-42da-8672-90e1dc58f598,image/diy/c1e7a004-292f-42da-8672-90e1dc58f598,image/diy/c1e7a004-292f-42da-8672-90e1dc58f598,LIVE,Movie,Captain Underpants Epic Choice-o-Rama,,,United States,2021,TV-Y7,81 min,"Children & Family Movies, Comedies","In this interactive special, Harold and George need your decision-making skills to stop Krupp from blowing their beloved treehouse to smithereens."
ax98_fgh_608810ae9335f700f3f8e697,PAID,mp4,video,2021-05-05,image/diy/7ae20ef2-8693-4d9a-8a87-69e100e1ee26,image/diy/7ae20ef2-8693-4d9a-8a87-69e100e1ee26,image/diy/7ae20ef2-8693-4d9a-8a87-69e100e1ee26,RELEGATED,Movie,Ultras,Francesco Lettieri,,Italy,2021,TV-MA,109 min,"Dramas, International Movies, Sports Movies",An aging soccer fanatic faces down the reality of his past while struggling to give himself and a young follower very different futures.
ax98_fgh_608d77f9b056880098e3e5e0,PAID,mp4,video,2021-05-05,image/diy/727934bc-77c4-4b4b-9dcc-89c18d864866,image/diy/727934bc-77c4-4b4b-9dcc-89c18d864866,image/diy/727934bc-77c4-4b4b-9dcc-89c18d864866,LIVE,Movie,Never Back Down 2: The Beatdown,Michael Jai White,,United States,2011,R,104 min,"Action & Adventure, Dramas, Sports Movies",A group of mixed martial arts fighters stars in this action thriller that follows a quartet of brawlers as they prepare for a major underground event.
ax98_fgh_61b0d7ae7797a5009f1039e9,PAID,mp4,video,2021-12-19,image/diy/86dfc009-d80e-4451-b5b9-1a1bb4c4ec29,image/diy/86dfc009-d80e-4451-b5b9-1a1bb4c4ec29,image/diy/86dfc009-d80e-4451-b5b9-1a1bb4c4ec29,RELEGATED,Movie,An Imperfect Murder,James Toback,,United States,2017,R,71 min,"Dramas, Thrillers","Haunted by a nightmare involving her abusive ex-boyfriend, an actress begins to question her reality and whether the incident took place."
ax98_fgh_6154a34cc0c96f00d0d91d39,FREE,mp4,video,2021-10-02,image/diy/5919513b-b89d-4331-81bd-d264a1ee48a4,image/diy/5919513b-b89d-4331-81bd-d264a1ee48a4,image/diy/5919513b-b89d-4331-81bd-d264a1ee48a4,RELEGATED,Movie,What Would Sophia Loren Do?,Ross Kauffman,,United States,2021,TV-14,32 min,Documentaries,"In this delightful short documentary, an Italian American grandmother and film buff finds strength and joy in the life of her screen idol, Sophia Loren."
ax98_fgh_60784c3faae91b00c27fedcf,PAID,mp4,video,2021-05-07,image/diy/c203f655-26df-407a-bc1a-51cb872c7258,image/diy/c203f655-26df-407a-bc1a-51cb872c7258,image/diy/c203f655-26df-407a-bc1a-51cb872c7258,LIVE,Movie,Pray Away,Kristine Stolakis,,United States,2021,PG-13,102 min,"Documentaries, LGBTQ Movies","Ex-leaders and a survivor of the so-called ""conversion therapy"" movement speak out about its harm to the LGBTQ+ community and its devastating persistence."
ax98_fgh_605b8d5c7e085100b551c551,PAID,mp4,video,2021-05-07,image/diy/c561b249-6675-428f-8f5c-a7e6b6c4d89d,image/diy/c561b249-6675-428f-8f5c-a7e6b6c4d89d,image/diy/c561b249-6675-428f-8f5c-a7e6b6c4d89d,LIVE,Movie,Shine Your Eyes,Matias Mariani,,"Brazil, France",2021,TV-MA,103 min,"Dramas, Independent Movies, International Movies","A Nigerian musician travels to Brazil to search for his estranged brother, who is living a life very different than the one his family thought."
ax98_fgh_60f57f6a9412ec009aeae7df,PAID,mp4,video,2021-08-08,image/diy/8955de30-e04d-47e5-9f3a-525aba723773,image/diy/8955de30-e04d-47e5-9f3a-525aba723773,image/diy/8955de30-e04d-47e5-9f3a-525aba723773,LIVE,Movie,Bright Star,Jane Campion,,"United Kingdom, Australia, France",2009,PG,119 min,"Dramas, Romantic Movies",This drama details the passionate three-year romance between Romantic poet John Keats – who died tragically at age 25 – and his great love and muse.
ax98_fgh_60727150a2a09600bc1acf96,PAID,mp4,video,2021-05-07,image/diy/707575e6-923a-4b4a-b7ec-f8cbf2af21ae,image/diy/707575e6-923a-4b4a-b7ec-f8cbf2af21ae,image/diy/707575e6-923a-4b4a-b7ec-f8cbf2af21ae,LIVE,Movie,Naruto the Movie: Ninja Clash in the Land of Snow,Tensai Okamura,,Japan,2004,TV-PG,83 min,"Action & Adventure, Anime Features, International Movies","Naruto, Sasuke and Sakura learn they'll be protecting an actress from being hurt while making her next film, but it turns out she's a princess."
ax98_fgh_6177f3c1405d5e00986af44f,PAID,mp4,video,2021-11-01,image/diy/569db6e2-0574-4e5e-b7ef-70a62954a5d6,image/diy/569db6e2-0574-4e5e-b7ef-70a62954a5d6,image/diy/569db6e2-0574-4e5e-b7ef-70a62954a5d6,LIVE,Movie,Oxygen,Alexandre Aja,,"France, United States",2021,TV-14,102 min,"Dramas, International Movies, Thrillers","After waking up in a cryogenic unit, Liz fights to survive and remember who she is before her oxygen runs out."
ax98_fgh_60f6ea27ee23d200b534bd9b,PAID,mp4,video,2021-08-29,image/diy/2135b8d6-094c-4d15-96b3-cc846e10a320,image/diy/2135b8d6-094c-4d15-96b3-cc846e10a320,image/diy/2135b8d6-094c-4d15-96b3-cc846e10a320,LIVE,Movie,Ride or Die,Ryuichi Hiroki,,Japan,2021,TV-MA,143 min,"Dramas, International Movies, LGBTQ Movies","Rei helps the woman she’s been in love with for years escape her abusive husband. While on the run, their feelings for each other catch fire."
ax98_fgh_5f4bb3384f23100091380913,PAID,mp4,video,2021-02-06,image/diy/90e7ff1d-0601-4dc2-8170-a49b65559b2c,image/diy/90e7ff1d-0601-4dc2-8170-a49b65559b2c,image/diy/90e7ff1d-0601-4dc2-8170-a49b65559b2c,RELEGATED,Movie,"Kalel, 15",Jun Lana,,Philippines,2019,TV-MA,105 min,"Dramas, Independent Movies, International Movies","Surrounded by tensions and secrets, a teenage boy searches for validation and navigates life with a dysfunctional family following an HIV diagnosis."
ax98_fgh_60b8e05b17c44700920cda97,PAID,mp4,video,2021-06-08,image/diy/f35c8c14-c400-4771-b735-d1b1c6356a0a,image/diy/f35c8c14-c400-4771-b735-d1b1c6356a0a,image/diy/f35c8c14-c400-4771-b735-d1b1c6356a0a,RELEGATED,Movie,Christmas Break-In,Michael Kampa,,United States,2019,TV-PG,87 min,"Children & Family Movies, Comedies","Stranded at school before holiday break, a precocious girl gets into the spirit of saving when a trio of robbers trespass and hold the janitor hostage."
ax98_fgh_6069e78e8d5ea000b752f9fd,PAID,mp4,video,2021-04-09,image/diy/4a0c6864-a528-4806-a062-91752e493a27,image/diy/4a0c6864-a528-4806-a062-91752e493a27,image/diy/4a0c6864-a528-4806-a062-91752e493a27,LIVE,Movie,Don’t Listen,Ángel Gómez Hernández,,Spain,2021,TV-MA,98 min,"Horror Movies, International Movies","After a tragic turn of events at the new home he's fixing up, Daniel hears a ghostly plea for help, spurring him to seek out a famous paranormal expert."
ax98_fgh_60e33e9dd4733f009fe2c1b9,PAID,mp4,video,2021-07-08,image/diy/fd6d3c50-2983-4297-88f6-4a0206406a25,image/diy/fd6d3c50-2983-4297-88f6-4a0206406a25,image/diy/fd6d3c50-2983-4297-88f6-4a0206406a25,LIVE,Movie,Fantastica,Barry Gonzalez,,Philippines,2018,TV-PG,114 min,"Comedies, International Movies, LGBTQ Movies",The owner of a struggling carnival starts putting on small-time shows to save his wonderland as an old friend asks for help with a magical mission.
ax98_fgh_5e958a36c5392200af7f5e59,PAID,mp4,video,2021-05-12,image/diy/4393be03-d2b0-4f9d-a921-89ec7e737c16,image/diy/4393be03-d2b0-4f9d-a921-89ec7e737c16,image/diy/4393be03-d2b0-4f9d-a921-89ec7e737c16,LIVE,Movie,Stowaway,Joe Penna,,"Germany, United States",2021,TV-MA,116 min,"Dramas, International Movies, Thrillers",A three-person crew on a mission to Mars faces an impossible choice when an unplanned passenger jeopardizes the lives of everyone on board.
ax98_fgh_5ffd672e25a6c60091e17f56,PAID,mp4,video,2021-04-06,image/diy/12cadafc-daf3-4704-b32b-9bae75ce4383,image/diy/12cadafc-daf3-4704-b32b-9bae75ce4383,image/diy/12cadafc-daf3-4704-b32b-9bae75ce4383,RELEGATED,Movie,Osuofia in London II,Kingsley Ogoro,,,2004,TV-14,70 min,"Comedies, Dramas, International Movies","After collecting his brother's inheritance, Osoufia returns to his Nigerian village with wealth and a British wife whose presence soon causes trouble."
ax98_fgh_606d4ad1b259640092a91669,PAID,mp4,video,2021-05-05,image/diy/c761c16e-ac85-4df6-bd4e-95f8684a8114,image/diy/c761c16e-ac85-4df6-bd4e-95f8684a8114,image/diy/c761c16e-ac85-4df6-bd4e-95f8684a8114,LIVE,Movie,9to5: The Story of a Movement,,,,2021,TV-MA,85 min,Documentaries,"In this documentary, female office workers in '70s Boston inspire change with a call for better pay, more opportunities and an end to sexual harassment."
ax98_fgh_6006ec18fc6d1100b3a158f1,PAID,mp4,video,2021-05-07,image/diy/1d80307c-7bff-44a3-b3cc-013d51fc22cd,image/diy/1d80307c-7bff-44a3-b3cc-013d51fc22cd,image/diy/1d80307c-7bff-44a3-b3cc-013d51fc22cd,RELEGATED,Movie,August: Osage County,John Wells,,United States,2014,R,121 min,Dramas,"When their father disappears, three strong-willed women return to their childhood home and to their equally strong-willed mother."
ax98_fgh_6108d2dacccc42009a28c589,PAID,mp4,video,2021-08-07,image/diy/199a86f5-8650-44a4-b156-08c4edfe6ac2,image/diy/199a86f5-8650-44a4-b156-08c4edfe6ac2,image/diy/199a86f5-8650-44a4-b156-08c4edfe6ac2,LIVE,Movie,Cobra Kai - The Afterparty,,,,2021,TV-MA,34 min,Movies,"Ralph Macchio, William Zabka and more from the ""Cobra Kai"" cast drop by to chat Season 3 (spoilers ahead!), followed by Bill Burr of ""F Is for Family."""
ax98_fgh_5feeb79292ee3200a51f0531,FREE,mp4,video,2021-02-06,image/diy/b831fef0-ef0a-4f44-963e-176ebc90d046,image/diy/b831fef0-ef0a-4f44-963e-176ebc90d046,image/diy/b831fef0-ef0a-4f44-963e-176ebc90d046,LIVE,Movie,Piercing,Nicolas Pesce,,United States,2018,R,81 min,"Dramas, Independent Movies, Thrillers",A family man plots to kill a spellbinding sex worker but ends up in a psychosexual exercise to outwit his twisted target.
ax98_fgh_60a92a9a9f618800c3043f2d,FREE,mp4,video,2021-08-07,image/diy/f0efa977-b8ff-43f3-a3b2-ee8d4ea4be9f,image/diy/f0efa977-b8ff-43f3-a3b2-ee8d4ea4be9f,image/diy/f0efa977-b8ff-43f3-a3b2-ee8d4ea4be9f,RELEGATED,Movie,Mandela: Long Walk to Freedom,Justin Chadwick,,"United Kingdom, South Africa, France",2013,PG-13,141 min,"Dramas, International Movies",This in-depth biopic portrays groundbreaking South African leader Nelson Mandela's fight against political oppression and virulent racism.
ax98_fgh_60eaa8a917379800991c370e,PAID,mp4,video,2021-08-17,image/diy/4cc28f17-bca9-44df-ae44-68ab8a8d54e3,image/diy/4cc28f17-bca9-44df-ae44-68ab8a8d54e3,image/diy/4cc28f17-bca9-44df-ae44-68ab8a8d54e3,LIVE,Movie,Ya no estoy aquí: Una conversación entre Guillermo del Toro y Alfonso Cuarón,,,,2021,TV-PG,15 min,Documentaries,"Guillermo del Toro and Alfonso Cuarón discuss fellow Mexican director Fernando Frías de la Parra's award-winning film ""I'm No Longer Here."""
ax98_fgh_5f2e7f92ea9b8500d202cb6d,PAID,mp4,video,2021-05-31,image/diy/2469cbef-ac35-40ae-969c-3f38cece9628,image/diy/2469cbef-ac35-40ae-969c-3f38cece9628,image/diy/2469cbef-ac35-40ae-969c-3f38cece9628,RELEGATED,Movie,Tumi or not Tumi,Mfanelo Ngoma,,,2021,TV-MA,72 min,Stand-Up Comedy,"Tumi Morake dishes out hot takes and fiery commentary about the concept of identity, politics, family life, weaves, and more in this stand-up special."
ax98_fgh_5fc087ed21c35300d16b3cd1,PAID,mp4,video,2021-02-09,image/diy/3c8e7df4-b878-4030-a9d3-5b1d8fe185b0,image/diy/3c8e7df4-b878-4030-a9d3-5b1d8fe185b0,image/diy/3c8e7df4-b878-4030-a9d3-5b1d8fe185b0,LIVE,Movie,Au coeur des gangs,Vondie Curtis-Hall,,United States,2006,R,97 min,"Action & Adventure, Dramas","In Los Angeles, recently paroled O2 teams up with a street-smart hustler when a gang hijacks his car and holds his son for ransom."
ax98_fgh_607d75ce39f2ba00b48bda7c,PAID,mp4,video,2021-05-07,image/diy/c87a14de-21ef-40e0-8e2b-1c9382924cb7,image/diy/c87a14de-21ef-40e0-8e2b-1c9382924cb7,image/diy/c87a14de-21ef-40e0-8e2b-1c9382924cb7,RELEGATED,Movie,Chhota Bheem: Journey to Petra,Rajiv Chilaka,,,2011,TV-Y7,68 min,Children & Family Movies,"The king has been away to meet an old friend, but when he sends for urgent help, Bheem finds himself on an action-packed rescue mission to Egypt!"
ax98_fgh_607ed562effafb00bbd3cdad,PAID,mp4,video,2021-04-24,image/diy/50fffd4b-9440-4ca8-a790-d8d38cbb7dda,image/diy/50fffd4b-9440-4ca8-a790-d8d38cbb7dda,image/diy/50fffd4b-9440-4ca8-a790-d8d38cbb7dda,LIVE,Movie,A California Christmas,Shaun Paul Piccinino,,United States,2021,PG-13,107 min,"Comedies, Romantic Movies","With his carefree lifestyle on the line, a wealthy charmer poses as a ranch hand to get a hardworking farmer to sell her family’s land before Christmas."
ax98_fgh_60d5d83d62e6070092eed507,PAID,mp4,video,2021-06-28,image/diy/b3446a0e-3182-4f06-af23-39de3f1eb044,image/diy/b3446a0e-3182-4f06-af23-39de3f1eb044,image/diy/b3446a0e-3182-4f06-af23-39de3f1eb044,LIVE,Movie,Cinema Bandi,Praveen Kandregula,,India,2021,TV-MA,99 min,"Comedies, Independent Movies, International Movies",A struggling rickshaw driver’s life takes a rollicking turn when he comes upon an expensive camera and decides to make a film with his fellow villagers.
ax98_fgh_607486d336a04200de9cd9f8,PAID,mp4,video,2021-05-07,image/diy/7bce297f-1562-48d5-add3-850fdfb4a5f4,image/diy/7bce297f-1562-48d5-add3-850fdfb4a5f4,image/diy/7bce297f-1562-48d5-add3-850fdfb4a5f4,LIVE,Movie,Welcome Home,George Ratliff,,United States,2018,R,97 min,Thrillers,"A couple rents a villa in Italy hoping to mend their bruised relationship, but the devilishly charming homeowner can’t seem to leave them alone."
ax98_fgh_613ce177e5931e00d74233fa,PAID,mp4,video,2021-09-14,image/diy/7135ce4a-6fa3-41fc-9131-d255d6ddcb23,image/diy/7135ce4a-6fa3-41fc-9131-d255d6ddcb23,image/diy/7135ce4a-6fa3-41fc-9131-d255d6ddcb23,LIVE,Movie,Below Zero,Lluís Quílez,,Spain,2021,TV-MA,107 min,"Action & Adventure, International Movies","When a prisoner transfer van is attacked, the cop in charge must fight those inside and outside while dealing with a silent foe: the icy temperatures."
ax98_fgh_60eb23de17379800991c4006,PAID,mp4,video,2021-09-07,image/diy/95f75ed4-a36e-44ff-949c-92a6e3f60fac,image/diy/95f75ed4-a36e-44ff-949c-92a6e3f60fac,image/diy/95f75ed4-a36e-44ff-949c-92a6e3f60fac,LIVE,Movie,Desperados,LP,,United States,2021,TV-MA,107 min,"Comedies, Romantic Movies","After drunkenly sending a cringeworthy email, hopeless romantic Wes heads to Mexico with her best friends to erase the note before her new love reads it."
ax98_fgh_612ca39a9060b600920ea872,PAID,mp4,video,2021-09-02,image/diy/427d7318-9e83-4183-8faf-794a49eb53fc,image/diy/427d7318-9e83-4183-8faf-794a49eb53fc,image/diy/427d7318-9e83-4183-8faf-794a49eb53fc,LIVE,Movie,Lost Girls,Liz Garbus,,United States,2021,R,95 min,Dramas,"Desperate to find her missing daughter, a mother fights to uncover the truth — and helps expose a string of unsolved murders. Based on a true story."
ax98_fgh_60f70b6d01633a009378308c,PAID,mp4,video,2021-08-11,image/diy/02db4156-ce82-4d37-bbf5-63e1b9e700ff,image/diy/02db4156-ce82-4d37-bbf5-63e1b9e700ff,image/diy/02db4156-ce82-4d37-bbf5-63e1b9e700ff,LIVE,Movie,The Creative Brain,"Jennifer Beamish, Toby Trackman",,United States,2019,TV-14,53 min,Documentaries,"Neuroscientist David Eagleman taps into the creative process of various innovators while exploring brain-bending, risk-taking ways to spark creativity."
ax98_fgh_600e987b66a9880aeb36e2d2,PAID,mp4,video,2021-05-07,image/diy/13118c0f-8d5e-4583-872c-e05e21fb531b,image/diy/13118c0f-8d5e-4583-872c-e05e21fb531b,image/diy/13118c0f-8d5e-4583-872c-e05e21fb531b,RELEGATED,Movie,Dragonheart: Vengeance,Ivan Silvestrini,,United States,2021,PG-13,97 min,"Action & Adventure, Sci-Fi & Fantasy","When his family is slain by vicious savages, a young farmer teams with an ice-breathing dragon and sword-wielding mercenary to avenge their deaths."
ax98_fgh_60dca1b2d0d43d00c28ef4f8,PAID,mp4,video,2021-09-06,image/diy/ea594dd8-de6b-4455-b346-6e9bee53e58b,image/diy/ea594dd8-de6b-4455-b346-6e9bee53e58b,image/diy/ea594dd8-de6b-4455-b346-6e9bee53e58b,LIVE,Movie,Little Singham: Legend of Dugabakka,,,,2021,TV-Y7,68 min,"Children & Family Movies, Comedies","As fears rise over a ghost known for nighttime abductions, Mirchi Nagar residents look to the only person they know can save them: Little Singham!"
ax98_fgh_616681470fd97f00a7828301,PAID,mp4,video,2021-10-15,image/diy/f623819a-c725-4f5b-88f4-90438f93932d,image/diy/f623819a-c725-4f5b-88f4-90438f93932d,image/diy/f623819a-c725-4f5b-88f4-90438f93932d,RELEGATED,Movie,Domestic Disturbance,Harold Becker,,United States,2001,PG-13,89 min,Thrillers,A recovering alcoholic is skeptical of his son's claim that his new stepfather is a killer – but soon begins to sense the boy is telling the truth.
ax98_fgh_6005232b69f8dd00ba484042,FREE,mp4,video,2021-02-09,image/diy/666dcee3-5e1f-42a6-bc8e-a4facebbe3e6,image/diy/666dcee3-5e1f-42a6-bc8e-a4facebbe3e6,image/diy/666dcee3-5e1f-42a6-bc8e-a4facebbe3e6,LIVE,Movie,Lady Boss: The Jackie Collins Story,Laura Fairrie,,United Kingdom,2021,TV-14,97 min,Documentaries,"""Queen of Sleaze"" or feminist pioneer? Powerhouse novelist Jackie Collins created a brash sex-positive persona while hiding her private struggles."
ax98_fgh_611b8c0f6ea0c400a1f3b4ed,PAID,mp4,video,2021-08-21,image/diy/66870937-cc5e-4237-8593-27e3ebf08f34,image/diy/66870937-cc5e-4237-8593-27e3ebf08f34,image/diy/66870937-cc5e-4237-8593-27e3ebf08f34,LIVE,Movie,#FriendButMarried 2,Rako Prijanto,,Indonesia,2021,TV-G,104 min,"Dramas, International Movies, Romantic Movies","As Ayu and Ditto finally transition from best friends to newlyweds, a quick pregnancy creates uncertainty for the future of their young marriage."
ax98_fgh_61714b595a4d66009261c1db,PAID,mp4,video,2021-11-04,image/diy/d3783553-6808-4968-ae60-6882667380e1,image/diy/d3783553-6808-4968-ae60-6882667380e1,image/diy/d3783553-6808-4968-ae60-6882667380e1,RELEGATED,Movie,Villain,Philip Barantini,,United Kingdom,2021,R,97 min,Dramas,"Fresh out of prison, an ex-con tries to save his debt-ridden brother and the family pub until local mobsters draw him back to a criminal underworld."
ax98_fgh_607da5a506c49b00ecf32ee8,PAID,mp4,video,2021-05-07,image/diy/dfdd9765-0468-4b3c-8f7d-a75d8de1cece,image/diy/dfdd9765-0468-4b3c-8f7d-a75d8de1cece,image/diy/dfdd9765-0468-4b3c-8f7d-a75d8de1cece,LIVE,Movie,What Are the Odds?,Megha Ramaswamy,,India,2021,TV-MA,92 min,"Comedies, Dramas, Independent Movies","When two unlikely friends play hooky from school, accidental encounters and otherworldly events turn their day into a whimsical coming-of-age journey."
ax98_fgh_5feab9844739f700994ad77f,FREE,mp4,video,2021-02-06,image/diy/13ea0c36-1a16-4114-9ace-d13cadd53a80,image/diy/13ea0c36-1a16-4114-9ace-d13cadd53a80,image/diy/13ea0c36-1a16-4114-9ace-d13cadd53a80,LIVE,Movie,Prospect,"Zeek Earl, Christopher Caldwell",,"Canada, United States",2018,R,100 min,"Sci-Fi & Fantasy, Thrillers",A father and daughter travel to an alien moon in search of a valuable gem but are forced to alter their plans when a nefarious outlaw gets involved.
ax98_fgh_5ee6333b849ecb00b3445264,PAID,mp4,video,2021-01-26,image/diy/71af27bb-970c-4fc5-8e6e-816272f3a143,image/diy/71af27bb-970c-4fc5-8e6e-816272f3a143,image/diy/71af27bb-970c-4fc5-8e6e-816272f3a143,LIVE,Movie,Jingle Jangle: A Christmas Journey,David E. Talbert,,United States,2021,PG,124 min,"Children & Family Movies, Music & Musicals","Decades after his trusted apprentice betrayed him, a once-joyful toymaker finds new hope when his kind and curious granddaughter comes into his life."
ax98_fgh_5fa2aae054d43a00b3ed01e8,PAID,mp4,video,2021-04-09,image/diy/e639f415-da2d-4f6e-b153-79801991341b,image/diy/e639f415-da2d-4f6e-b153-79801991341b,image/diy/e639f415-da2d-4f6e-b153-79801991341b,LIVE,Movie,Arlo the Alligator Boy,Ryan Crego,,United States,2021,TV-Y7,93 min,"Children & Family Movies, Comedies, Music & Musicals","To find the father he never knew, optimistic Arlo leaves his swampy Southern home for New York City, making friends along the way. A musical adventure."
ax98_fgh_5f91531f4add9200f9f3e848,PAID,mp4,video,2021-01-26,image/diy/ce7e3cc6-b858-491e-a7ef-b8ba19533f78,image/diy/ce7e3cc6-b858-491e-a7ef-b8ba19533f78,image/diy/ce7e3cc6-b858-491e-a7ef-b8ba19533f78,LIVE,Movie,Dreamy Eyes,Victor Vu,,Vietnam,2019,TV-14,117 min,"Dramas, International Movies, Romantic Movies","Through heartbreak and betrayal, Ngan's unrequited love for his childhood best friend Hà La endures for a generation in this sweeping romance."
ax98_fgh_6093c945cfde4300ed5b57e9,PAID,mp4,video,2021-05-07,image/diy/6ba6e60e-d3d4-43e8-8f47-267ffcf06d2c,image/diy/6ba6e60e-d3d4-43e8-8f47-267ffcf06d2c,image/diy/6ba6e60e-d3d4-43e8-8f47-267ffcf06d2c,LIVE,Movie,Crip Camp: A Disability Revolution,,,United States,2021,R,108 min,Documentaries,"A groundbreaking summer camp galvanizes a group of teens with disabilities to help build a movement, forging a new path toward greater equality."
