content_id,accesslevel,contentformat,contenttype,date_added,imagedetails_heroimage,imagedetails_thumbnailimage,imagedetails_todayimage,status,type,title,director,cast,country,release_year,rating,duration,listed_in,description
ax98_fgh_61c0a3944f4a3c00de65bac5,PAID,mp4,video,2021-12-26,image/diy/3f55bb8b-ccd8-45d9-8053-36cf2a3458d9,image/diy/3f55bb8b-ccd8-45d9-8053-36cf2a3458d9,image/diy/3f55bb8b-ccd8-45d9-8053-36cf2a3458d9,LIVE,Movie,Twin Murders: the Silence of the White City,Daniel Calparsoro,,Spain,2021,TV-MA,110 min,"International Movies, Thrillers",A detective returns to Vitoria-Gasteiz to solve murders mimicking those allegedly committed by a serial killer who's about to be released from prison.
ax98_fgh_60962ccfb9402e0f431902e6,FREE,mp4,video,2021-05-10,image/diy/47338e01-29c9-4e44-ad1c-4327795bc652,image/diy/47338e01-29c9-4e44-ad1c-4327795bc652,image/diy/47338e01-29c9-4e44-ad1c-4327795bc652,RELEGATED,Movie,The Water Man,David Oyelowo,,United States,2021,PG,92 min,"Children & Family Movies, Dramas","Desperate to save his ailing mother, 11-year-old Gunner runs away from home on a quest to find a mythic figure rumored to have the power to cheat death."
ax98_fgh_61af4751b67468009f6f828f,PAID,mp4,video,2021-12-11,image/diy/8ee041aa-4bd7-4b81-901c-f679f21ad969,image/diy/8ee041aa-4bd7-4b81-901c-f679f21ad969,image/diy/8ee041aa-4bd7-4b81-901c-f679f21ad969,LIVE,Movie,A Second Chance:  Rivals!,Clay Glen,,Australia,2021,PG,91 min,"Children & Family Movies, Sports Movies","Crushed when she doesn't qualify for the Olympics, a now-grown Maddy Cornell finds new purpose coaching young gymnasts going up against a rival team."
ax98_fgh_604a6b4d940aa200e5fdb75f,PAID,mp4,video,2021-03-20,image/diy/8f3ff024-5934-4f61-9602-9b43f12fce90,image/diy/8f3ff024-5934-4f61-9602-9b43f12fce90,image/diy/8f3ff024-5934-4f61-9602-9b43f12fce90,RELEGATED,Movie,Rurouni Kenshin: The Beginning,Keishi Otomo,,,2021,TV-MA,138 min,"Action & Adventure, International Movies","Before he was a protector, Kenshin was a fearsome assassin known as Battosai. But when he meets the gentle Tomoe Yukishiro, his story begins to change."
ax98_fgh_60be1eb7ee177200d0b1743e,FREE,mp4,video,2021-07-02,image/diy/33dc2610-275a-4296-b7a6-5d9a991d4235,image/diy/33dc2610-275a-4296-b7a6-5d9a991d4235,image/diy/33dc2610-275a-4296-b7a6-5d9a991d4235,RELEGATED,Movie,Tarung Sarung,Archie Hekagery,,Indonesia,2021,TV-PG,116 min,"Action & Adventure, Dramas, Faith & Spirituality","Wealthy and spoiled, a young man finds something to fight for when he falls in love with an environmental activist protesting his family's business."
ax98_fgh_5ec8df3a77f992013fbee1a8,PAID,mp4,video,2021-01-26,image/diy/05629427-75f4-4916-9556-054a7763b45d,image/diy/05629427-75f4-4916-9556-054a7763b45d,image/diy/05629427-75f4-4916-9556-054a7763b45d,LIVE,Movie,Uma Maheswara Ugra Roopasya,Venkatesh Maha,,India,2021,TV-MA,137 min,"Comedies, Dramas, Independent Movies","Defeated and humiliated in a fight while trying to defuse a conflict among his fellow villagers, a photographer vows revenge on his attacker."
ax98_fgh_601f81e75235960092cce50c,PAID,mp4,video,2021-05-07,image/diy/74de95b5-cc22-4671-b7e9-c105f6e5c3cf,image/diy/74de95b5-cc22-4671-b7e9-c105f6e5c3cf,image/diy/74de95b5-cc22-4671-b7e9-c105f6e5c3cf,RELEGATED,Movie,Romance Doll,Yuki Tanada,,Japan,2021,TV-MA,124 min,"Dramas, International Movies, Romantic Movies","Love came naturally for married couple Sonoko and Tetsuo. But his secret profession as a love doll designer clashes with her deeper, darker secret."
ax98_fgh_6176271cf4d77b0092144ed0,PAID,mp4,video,2021-10-27,image/diy/a308843b-4122-4e06-aa74-348e689a1915,image/diy/a308843b-4122-4e06-aa74-348e689a1915,image/diy/a308843b-4122-4e06-aa74-348e689a1915,RELEGATED,Movie,Seven Souls in the Skull Castle 2011,Hidenori Inoue,,,2011,TV-14,177 min,"Action & Adventure, Dramas, International Movies","In this cinematic distillation of the electrifying stage performance, seven spirited souls take on the dark threat growing in shadowy Skull Castle."
ax98_fgh_604356782ea860009863d7d0,PAID,mp4,video,2021-03-10,image/diy/ebe90f52-0eda-4aa7-9fdc-c1007c0e99a8,image/diy/ebe90f52-0eda-4aa7-9fdc-c1007c0e99a8,image/diy/ebe90f52-0eda-4aa7-9fdc-c1007c0e99a8,DRAFT,Movie,The Shadow of Violence,Nick Rowland,,"United Kingdom, Ireland",2021,R,101 min,Dramas,"As he reconciles with his ex and their son, an enforcer for a crime family gets an order that tests his loyalty and endangers everyone he holds dear."
ax98_fgh_6020bc5bc9659b00d14b0386,PAID,mp4,video,2021-02-10,image/diy/494cf2f9-c1bc-4239-a89a-57cc6f466e7a,image/diy/494cf2f9-c1bc-4239-a89a-57cc6f466e7a,image/diy/494cf2f9-c1bc-4239-a89a-57cc6f466e7a,LIVE,Movie,Table Manners,Leli Maki,,"Canada, South Africa",2018,TV-MA,104 min,"Comedies, Dramas, International Movies","When a housewife's picture-perfect life comes crashing down, she finds solace and hope through cooking, family and love."
ax98_fgh_6132035575ec520092f891ec,PAID,mp4,video,2021-09-06,image/diy/83ea4227-0492-4999-810a-7db45a97d519,image/diy/83ea4227-0492-4999-810a-7db45a97d519,image/diy/83ea4227-0492-4999-810a-7db45a97d519,LIVE,Movie,Lying and Stealing,Matt Aselton,,United States,2019,R,100 min,Thrillers,"A talented thief teams up with an aspiring actress to steal art from LA's high rollers. For their last heist, they're going for the ultimate: freedom."
ax98_fgh_60969f36855ff215c7b99026,PAID,mp4,video,2021-05-10,image/diy/ed924f27-93b7-4b04-a493-f07d50aa583c,image/diy/ed924f27-93b7-4b04-a493-f07d50aa583c,image/diy/ed924f27-93b7-4b04-a493-f07d50aa583c,LIVE,Movie,My Heroes Were Cowboys,Tyler Greco,,,2021,PG,23 min,Documentaries,"Robin Wiltshire's painful childhood was rescued by Westerns. Now he lives on the frontier of his dreams, training the horses he loves for the big screen."
ax98_fgh_60215d55ee2a38009970d63d,PAID,mp4,video,2021-02-10,image/diy/824e26fa-add2-4dc8-b061-533e6f776908,image/diy/824e26fa-add2-4dc8-b061-533e6f776908,image/diy/824e26fa-add2-4dc8-b061-533e6f776908,LIVE,Movie,Shiva: Journey to Plunotaria,Suhas Kadav,,,2019,TV-Y7,81 min,Children & Family Movies,Young superhero Shiva must use his powers to thwart a scheming scientist’s plans to blast Earth with explosive pellets from planet Plunotaria.
ax98_fgh_5ecfc8f4ba4b6a00d6a8d2a2,PAID,mp4,video,2021-02-04,image/diy/aaffc6f8-7a3f-48de-9291-03df39df45d5,image/diy/aaffc6f8-7a3f-48de-9291-03df39df45d5,image/diy/aaffc6f8-7a3f-48de-9291-03df39df45d5,LIVE,Movie,Pomegranates and Myrrh,Najwa Najjar,,,2009,TV-14,95 min,"Dramas, Independent Movies, International Movies","After her husband is placed under Israeli detention, a Palestinian newlywed is left to deal with the fallout, resorting to her passion for Dabke to cope."
ax98_fgh_600849a6f5694000c2296e0a,PAID,mp4,video,2021-01-26,image/diy/497ce2b1-49b8-430e-aa8a-1a87d36a0c26,image/diy/497ce2b1-49b8-430e-aa8a-1a87d36a0c26,image/diy/497ce2b1-49b8-430e-aa8a-1a87d36a0c26,LIVE,Movie,Da 5 Bloods,Spike Lee,,United States,2021,R,156 min,"Action & Adventure, Dramas",Four African American veterans return to Vietnam decades after the war to find their squad leader's remains — and a stash of buried gold. From Spike Lee.
ax98_fgh_607ef94f9824df09cd907995,PAID,mp4,video,2021-04-28,image/diy/c0ad26ca-fa39-4bc8-8382-18018a5345ef,image/diy/c0ad26ca-fa39-4bc8-8382-18018a5345ef,image/diy/c0ad26ca-fa39-4bc8-8382-18018a5345ef,LIVE,Movie,The Nutty Professor II: The Klumps,Peter Segal,,,2000,PG-13,107 min,"Comedies, Romantic Movies","After getting engaged, Sherman Klump prepares for his big day. But his sinister alter ego Buddy Love threatens to ruin his wedding and reputation."
ax98_fgh_604059cc1813b300e09f3008,FREE,mp4,video,2021-03-31,image/diy/ef4b075b-b25a-43f7-b133-8e076de876ce,image/diy/ef4b075b-b25a-43f7-b133-8e076de876ce,image/diy/ef4b075b-b25a-43f7-b133-8e076de876ce,LIVE,Movie,The Starling,Theodore Melfi,,United States,2021,PG-13,104 min,"Comedies, Dramas",A woman adjusting to life after a loss contends with a feisty bird that's taken over her garden — and a husband who's struggling to find a way forward.
ax98_fgh_6144f88be874bf00c9d6c156,PAID,mp4,video,2021-09-20,image/diy/998e1f11-c70e-44d0-8c4b-434b7818d6d0,image/diy/998e1f11-c70e-44d0-8c4b-434b7818d6d0,image/diy/998e1f11-c70e-44d0-8c4b-434b7818d6d0,LIVE,Movie,Bling Empire - The Afterparty,,,,2021,TV-MA,36 min,Movies,"The stars of ""Bling Empire"" discuss the show's success and play bling-themed games, then comic Joel Kim Booster makes his case for joining the cast."
ax98_fgh_61c220adf780430092a46e63,FREE,mp4,video,2021-12-29,image/diy/30efcd19-9500-4fa5-a8f8-574160aa5aea,image/diy/30efcd19-9500-4fa5-a8f8-574160aa5aea,image/diy/30efcd19-9500-4fa5-a8f8-574160aa5aea,LIVE,Movie,76,Izu Ojukwu,,Nigeria,2016,TV-PG,118 min,"Dramas, International Movies","When her husband is accused of taking part in an attempted military coup, a pregnant woman's life takes an emotional turn. Inspired by true events."
ax98_fgh_61115c86eaad120099da8cbd,PAID,mp4,video,2021-08-13,image/diy/31372a19-7892-4eb7-ba15-ff8021fc21ad,image/diy/31372a19-7892-4eb7-ba15-ff8021fc21ad,image/diy/31372a19-7892-4eb7-ba15-ff8021fc21ad,LIVE,Movie,Life of Crime,Daniel Schechter,,United States,2013,R,101 min,"Comedies, Independent Movies","After two small-time crooks kidnap and ransom a rich businessman's wife, they discover a flaw in their plan: Her cheating husband doesn't want her back."
ax98_fgh_5ffb1e46c4c6ac7f2046aafb,PAID,mp4,video,2021-05-07,image/diy/d039551c-e404-4423-9126-dff7d34d9654,image/diy/d039551c-e404-4423-9126-dff7d34d9654,image/diy/d039551c-e404-4423-9126-dff7d34d9654,RELEGATED,Movie,I Am Woman,Unjoo Moon,,Australia,2019,TV-MA,117 min,"Dramas, Music & Musicals","In the 1960s, Australian singer Helen Reddy struggles with misogyny in the music business — until she records an anthem for the women's movement."
ax98_fgh_5fb10661b630aa00e4c2b3fd,PAID,mp4,video,2021-01-26,image/diy/f7be2d49-16a7-43c8-a896-766b181a0797,image/diy/f7be2d49-16a7-43c8-a896-766b181a0797,image/diy/f7be2d49-16a7-43c8-a896-766b181a0797,LIVE,Movie,Until Midnight,Tariq Alkazim,,United Arab Emirates,2019,TV-14,77 min,"International Movies, Thrillers","After returning home from a work trip, a newlywed must fight off a masked intruder before his wife returns at midnight."
ax98_fgh_5ff3f7562af7dd00ba86b5e3,FREE,mp4,video,2021-02-06,image/diy/d653a7f6-87af-4048-9dca-aa5c2ceaba7d,image/diy/d653a7f6-87af-4048-9dca-aa5c2ceaba7d,image/diy/d653a7f6-87af-4048-9dca-aa5c2ceaba7d,LIVE,Movie,Xtreme,Daniel Benmayor,,Spain,2021,TV-MA,112 min,"Action & Adventure, International Movies","In this fast-paced and action-packed thriller, a retired hitman — along with his sister and a troubled teen — takes revenge on his lethal stepbrother."
ax98_fgh_5f5b7640d70ed700f219bd5b,FREE,mp4,video,2021-04-09,image/diy/46ec59dd-26fb-4782-bbdc-f1a6ade06065,image/diy/46ec59dd-26fb-4782-bbdc-f1a6ade06065,image/diy/46ec59dd-26fb-4782-bbdc-f1a6ade06065,LIVE,Movie,Rich in Love,Bruno Garotti,,Brazil,2021,TV-14,105 min,"Comedies, International Movies, Romantic Movies","Rich kid Teto is determined to prove himself to Paula, his love interest. But when he tells her he grew up poor, the lie spins out of control."
ax98_fgh_5faff6cfdc85bb00a40d5d1f,PAID,mp4,video,2021-05-05,image/diy/d5e044e9-1e14-49b9-90f6-50bca1416914,image/diy/d5e044e9-1e14-49b9-90f6-50bca1416914,image/diy/d5e044e9-1e14-49b9-90f6-50bca1416914,LIVE,Movie,The Last Paradiso,Rocco Ricciardulli,,Italy,2021,TV-MA,107 min,"Dramas, International Movies, Romantic Movies","In 1950s Italy, a passionate free spirit dreams of love, justice and a better life till a forbidden affair threatens everything. Based on real events."
ax98_fgh_5ff7e024b3ac0e009f7f7cd5,PAID,mp4,video,2021-02-06,image/diy/861f1001-d3a6-4fb4-8683-98d7b216eaec,image/diy/861f1001-d3a6-4fb4-8683-98d7b216eaec,image/diy/861f1001-d3a6-4fb4-8683-98d7b216eaec,RELEGATED,Movie,This Little Love Of Mine,Christine Luby,,Australia,2021,TV-G,92 min,"International Movies, Romantic Movies",A workaholic lawyer returns to her island home to convince an old friend to take over his family’s company — but rekindled feelings soon get in the way.
ax98_fgh_6176276ba86c5000a68274b6,PAID,mp4,video,2021-10-27,image/diy/2d6a4c7b-3579-41b1-98c9-750839f76349,image/diy/2d6a4c7b-3579-41b1-98c9-750839f76349,image/diy/2d6a4c7b-3579-41b1-98c9-750839f76349,RELEGATED,Movie,Bigflo & Oli: Hip Hop Frenzy,"Bigflo & Oli, Jérémie Levypon",,France,2021,TV-MA,100 min,"Documentaries, International Movies, Music & Musicals","Go backstage with French rap duo Bigflo & Oli in this intimate music documentary, then join the superstar siblings as they embark on a major tour."
ax98_fgh_60c75b175dd90100a64d7ad9,PAID,mp4,video,2021-06-17,image/diy/9bc22949-f3cd-4576-89bb-dec30cf604c9,image/diy/9bc22949-f3cd-4576-89bb-dec30cf604c9,image/diy/9bc22949-f3cd-4576-89bb-dec30cf604c9,LIVE,Movie,Fate of Alakada,Kayode Kasum,,Nigeria,2021,TV-14,113 min,"Comedies, International Movies","Faking her way through any situation, a social media influencer poses as an event planner and is tasked with throwing an extravagant, star-studded bash."
ax98_fgh_609968b1b5063b0a5896d76e,PAID,mp4,video,2021-05-13,image/diy/6c94bbe8-7ea3-434e-9306-089c2b50343c,image/diy/be9b2e60-9b7a-4a87-865f-8a36aed69fb4,image/diy/aa618ac8-1f73-4f54-9f6d-cee6f7fb390e,LIVE,Movie,Sarbath,Prabhakaran,,India,2021,TV-PG,113 min,"Comedies, Dramas, International Movies","When a city man returns to his native village for his brother’s wedding, several unforeseen snags make his visit more eventful than anticipated."
ax98_fgh_61ab365ab64fe000aef0d864,FREE,mp4,video,2021-12-11,image/diy/1653629d-2ea1-4c0e-81e9-6959a8ad8a36,image/diy/1653629d-2ea1-4c0e-81e9-6959a8ad8a36,image/diy/1653629d-2ea1-4c0e-81e9-6959a8ad8a36,RELEGATED,Movie,Fearless,Cory Edwards,,Canada,2021,TV-Y7,92 min,"Children & Family Movies, Comedies",A teen gamer is forced to level up to full-time babysitter when his favorite video game drops three superpowered infants from space into his backyard.
ax98_fgh_614b6a7fd99c9d00de37ad3a,PAID,mp4,video,2021-10-02,image/diy/7f9ec403-a2f5-4c58-b9e3-9da3b2d8ac19,image/diy/7f9ec403-a2f5-4c58-b9e3-9da3b2d8ac19,image/diy/7f9ec403-a2f5-4c58-b9e3-9da3b2d8ac19,LIVE,Movie,The Lincoln Lawyer,Brad Furman,,United States,2011,R,118 min,"Dramas, Thrillers",A street-wise defense lawyer who operates out of the back seat of his Lincoln lands a high-profile case that soon puts him and his family in danger.
ax98_fgh_60fd7af758d70e00a8fcf767,PAID,mp4,video,2021-09-07,image/diy/0277ed75-590e-4990-9dc0-591d9952a8fd,image/diy/0277ed75-590e-4990-9dc0-591d9952a8fd,image/diy/0277ed75-590e-4990-9dc0-591d9952a8fd,LIVE,Movie,Motu Patlu Dino Invasion,Suhas Kadav,,,2018,TV-Y7,80 min,"Children & Family Movies, Comedies","A time machine sends Motu and Patlu back to the dinosaur period, but the real trouble starts when the reptiles travel back to the present day with them!"
ax98_fgh_6107e0ca367e2200d7a8dc1e,PAID,mp4,video,2021-08-27,image/diy/b812c272-83d2-4d69-9cec-87b84f2195be,image/diy/b812c272-83d2-4d69-9cec-87b84f2195be,image/diy/b812c272-83d2-4d69-9cec-87b84f2195be,RELEGATED,Movie,"Strip Down, Rise Up",Michèle Ohayon,,United States,2021,R,113 min,Documentaries,"In an effort to reclaim their bodies and lives, a group of women explore the intersections of movement and meaning in a powerful pole dancing program."
ax98_fgh_601a3f100706cf00def1a281,PAID,mp4,video,2021-02-11,image/diy/99c2625a-8f0e-4d12-a27b-cbbcdd8b4116,image/diy/99c2625a-8f0e-4d12-a27b-cbbcdd8b4116,image/diy/99c2625a-8f0e-4d12-a27b-cbbcdd8b4116,RELEGATED,Movie,Then Came You,Peter Hutchings,,United States,2019,TV-MA,97 min,"Comedies, Dramas, Independent Movies",A hypochondriac confronts his fear of death when a terminally ill teen girl enlists him to help her complete her bucket list.
ax98_fgh_61c5aa215aa43400b4946956,PAID,mp4,video,2021-12-28,image/diy/318a095e-4362-41b2-978f-4738a1a12cdc,image/diy/318a095e-4362-41b2-978f-4738a1a12cdc,image/diy/318a095e-4362-41b2-978f-4738a1a12cdc,LIVE,Movie,Dragons: Rescue Riders: Secrets of the Songwing,"Greg Rankin, TJ Sullivan",,United States,2021,TV-Y,46 min,"Children & Family Movies, Comedies","When a musical dragon with a beautiful voice hypnotizes the dragons and people of Huttsgalor, the Rescue Riders have to find a way to break the spell."
ax98_fgh_6042850263f72700fa7d2dc0,PAID,mp4,video,2021-03-10,image/diy/d341878f-13fb-41df-8004-95414576d696,image/diy/d341878f-13fb-41df-8004-95414576d696,image/diy/d341878f-13fb-41df-8004-95414576d696,DRAFT,Movie,Kocan Kadar Konus 2: Dirilis,Kıvanç Baruönü,,Turkey,2016,TV-14,104 min,"Comedies, International Movies, Romantic Movies","Efsun has found Mr. Right in Sinan, and their relationship is taking a serious turn. But their eccentric families quickly complicate the romance."
ax98_fgh_615f2ab532ea5b00de46a289,PAID,mp4,video,2021-10-16,image/diy/ceab8280-6d5a-4184-81a5-2ff8e4d5b980,image/diy/ceab8280-6d5a-4184-81a5-2ff8e4d5b980,image/diy/ceab8280-6d5a-4184-81a5-2ff8e4d5b980,LIVE,Movie,Malang,Mohit Suri,,India,2021,TV-MA,131 min,"Action & Adventure, International Movies, Romantic Movies","Years after a police encounter separates him from his lover, an angry young man goes on a killing spree, with an equally vengeful cop on his heels."
ax98_fgh_60e1c5f941acf100d100eae9,PAID,mp4,video,2021-07-07,image/diy/48721d30-2dbe-40ce-8e8b-32cd3dcd2f11,image/diy/48721d30-2dbe-40ce-8e8b-32cd3dcd2f11,image/diy/48721d30-2dbe-40ce-8e8b-32cd3dcd2f11,LIVE,Movie,The App That Stole Christmas,Monica Floyd,,United States,2021,TV-PG,64 min,"Children & Family Movies, Comedies","A tech entrepreneur's Christmas shopping app is a smashing success, but he starts to realize his invention might be ruining the holiday spirit."
ax98_fgh_61128f494f75ea00993e0e6e,PAID,mp4,video,2021-08-15,image/diy/059ab3f6-a7b1-4666-ad3e-325e3ccb39c7,image/diy/059ab3f6-a7b1-4666-ad3e-325e3ccb39c7,image/diy/059ab3f6-a7b1-4666-ad3e-325e3ccb39c7,LIVE,Movie,Fireplace 4K: Crackling Birchwood from Fireplace for Your Home,George Ford,,,2015,TV-G,60 min,Movies,"For the first time in 4K Ultra-HD, everyone's favorite Yuletide fireplace snaps and crackles in crystal clear, high-def holiday warmth."
ax98_fgh_6034c88fd77bda009967d5b1,FREE,mp4,video,2021-05-07,image/diy/d52dec0c-d6bc-449c-9e66-ab0f45e33ad7,image/diy/d52dec0c-d6bc-449c-9e66-ab0f45e33ad7,image/diy/d52dec0c-d6bc-449c-9e66-ab0f45e33ad7,RELEGATED,Movie,Into the Wind,Sofie Šustková,,,2018,TV-MA,76 min,"Dramas, Independent Movies, International Movies",Two siblings set sail as a crew on a yacht on the Aegean Sea. Circumstances soon change when a young documentary filmmaker comes aboard.
ax98_fgh_60f57cc18a51f000a10c748c,PAID,mp4,video,2021-08-09,image/diy/b42bca3a-adec-4bc3-ac23-dd505d5b779e,image/diy/b42bca3a-adec-4bc3-ac23-dd505d5b779e,image/diy/b42bca3a-adec-4bc3-ac23-dd505d5b779e,LIVE,Movie,How to Be Really Bad,Marco Petry,,Germany,2018,TV-14,100 min,"Comedies, International Movies","The devil's sassy (and bored) daughter makes a deal with her dad: If she can turn a good person evil, she gets to ditch hell and stay on Earth."
ax98_fgh_607c56f829d99b09ce92eaec,PAID,mp4,video,2021-05-07,image/diy/a10b7340-fdd6-46b8-904f-c2c1b7a5c748,image/diy/a10b7340-fdd6-46b8-904f-c2c1b7a5c748,image/diy/a10b7340-fdd6-46b8-904f-c2c1b7a5c748,LIVE,Movie,Omo Ghetto: the Saga,"JJC Skillz, Funke Akindele",,Nigeria,2021,TV-MA,147 min,"Action & Adventure, Comedies, Dramas","Twins are reunited as a good-hearted female gangster and her uptight rich sister take on family, crime, cops and all of the trouble that follows them."
ax98_fgh_61be1fe71d794400c292608c,PAID,mp4,video,2021-12-22,image/diy/fb3a74af-33ff-4a7f-993f-e1cf20bb5925,image/diy/fb3a74af-33ff-4a7f-993f-e1cf20bb5925,image/diy/fb3a74af-33ff-4a7f-993f-e1cf20bb5925,LIVE,Movie,This Changes Everything,Tom Donahue,,United States,2019,TV-MA,96 min,Documentaries,This documentary takes a deep look at gender disparity in Hollywood through the eyes of well-known actresses and female filmmakers.
ax98_fgh_61a1e776a8ad4c00a6e5b8ba,PAID,mp4,video,2021-12-02,image/diy/3823eb36-a958-4ab8-8677-f75fdc0758d4,image/diy/3823eb36-a958-4ab8-8677-f75fdc0758d4,image/diy/3823eb36-a958-4ab8-8677-f75fdc0758d4,RELEGATED,Movie,All Day and a Night,Joe Robert Cole,,United States,2021,R,122 min,"Dramas, Independent Movies","While serving life in prison, a young man looks back at the people, the circumstances and the system that set him on the path toward his crime."
ax98_fgh_61af40dd61aab800b4be3bea,PAID,mp4,video,2021-12-23,image/diy/ad82851b-2815-4913-b2c3-02d4dc225161,image/diy/ad82851b-2815-4913-b2c3-02d4dc225161,image/diy/ad82851b-2815-4913-b2c3-02d4dc225161,RELEGATED,Movie,Silver Linings Playbook,David O. Russell,,United States,2012,R,122 min,"Comedies, Dramas, Independent Movies","A man with bipolar disorder moves home with his parents and makes a connection with a spirited widow, which helps both of them heal in unique ways."
ax98_fgh_6090e3ebf47ebc00d07c1b04,PAID,mp4,video,2021-05-05,image/diy/e4218d2e-6c32-475a-89b0-6b504d5dabdb,image/diy/e4218d2e-6c32-475a-89b0-6b504d5dabdb,image/diy/e4218d2e-6c32-475a-89b0-6b504d5dabdb,RELEGATED,Movie,Super Me,Zhang Chong,,China,2021,TV-14,104 min,"Action & Adventure, Dramas, International Movies",A struggling screenwriter discovers his lucrative ability to bring antiques from his dreams into the real world — but his new life soon unravels.
ax98_fgh_61017fdcccf2d600aea9ca91,FREE,mp4,video,2021-08-21,image/diy/9559eade-8f5f-4d8b-85a8-332fc5cd9fc1,image/diy/9559eade-8f5f-4d8b-85a8-332fc5cd9fc1,image/diy/9559eade-8f5f-4d8b-85a8-332fc5cd9fc1,RELEGATED,Movie,The Happytime Murders,Brian Henson,,"United States, China, Canada",2018,R,91 min,"Action & Adventure, Comedies","In an LA where puppets and humans coexist, a down-on-his-luck detective teams with his ex-partner to nab a killer targeting the cast of an old TV show."
ax98_fgh_605ee1fdf0156e00f3600146,PAID,mp4,video,2021-04-09,image/diy/801f3490-a337-4e32-bf4b-2229c467dda8,image/diy/801f3490-a337-4e32-bf4b-2229c467dda8,image/diy/801f3490-a337-4e32-bf4b-2229c467dda8,DRAFT,Movie,Not a Game,Jose Gomez,,United Kingdom,2021,TV-MA,98 min,"Documentaries, International Movies, Sports Movies","This documentary offers an honest look at our fraught, complex relationship to video games from the perspectives of gamers and their concerned parents."
ax98_fgh_61bf6cd1b207f700a7d31bc3,PAID,mp4,video,2021-12-23,image/diy/8f964670-deb3-4402-8830-2307ec933702,image/diy/8f964670-deb3-4402-8830-2307ec933702,image/diy/8f964670-deb3-4402-8830-2307ec933702,LIVE,Movie,System Crasher,Nora Fingscheidt,,Germany,2021,TV-MA,120 min,"Dramas, Independent Movies, International Movies","Traumatized, violent and yearning for love, 9-year-old Benni bonds with a gruff mentor as child-services workers struggle to find her a home."
ax98_fgh_60b8cb2617c44700920cd8aa,PAID,mp4,video,2021-07-02,image/diy/8c5de87a-e260-4ce8-ba72-c6c8c09e9d51,image/diy/8c5de87a-e260-4ce8-ba72-c6c8c09e9d51,image/diy/8c5de87a-e260-4ce8-ba72-c6c8c09e9d51,RELEGATED,Movie,Mean Girls 2,Melanie Mayron,,United States,2011,PG-13,98 min,Comedies,The father of a high school pariah offers to pay another student's way through college if she makes friends with his outcast daughter.
ax98_fgh_61a1e672bd77b1009f110dd2,PAID,mp4,video,2021-12-02,image/diy/394874ab-8d07-4c4c-966b-4bb0ab853b50,image/diy/394874ab-8d07-4c4c-966b-4bb0ab853b50,image/diy/394874ab-8d07-4c4c-966b-4bb0ab853b50,RELEGATED,Movie,Bridgerton - The Afterparty,,,,2021,TV-14,39 min,Movies,"""Bridgerton"" cast members share behind-the-scenes stories from the hit show, plus comedian Nikki Glaser breaks down the costume drama's sexiest moments."
ax98_fgh_6159b92ef6c4ab00a0921f3d,PAID,mp4,video,2021-10-07,image/diy/400e2f33-698f-45c0-a960-5d79c0bbcf5f,image/diy/400e2f33-698f-45c0-a960-5d79c0bbcf5f,image/diy/400e2f33-698f-45c0-a960-5d79c0bbcf5f,LIVE,Movie,Choked: Paisa Bolta Hai,Anurag Kashyap,,India,2021,TV-14,114 min,"Dramas, International Movies",A bank employee weighed down by her jobless husband's debts — and her own broken dreams — finds a secret source of seemingly unlimited cash in her home.
ax98_fgh_5ff20b627d807546a0155948,PAID,mp4,video,2021-05-07,image/diy/acc42ebb-e516-42d5-a580-6e22d8169918,image/diy/acc42ebb-e516-42d5-a580-6e22d8169918,image/diy/acc42ebb-e516-42d5-a580-6e22d8169918,RELEGATED,Movie,Fierce,Anna Wieczur-Bluszcz,,Poland,2021,TV-MA,118 min,"Comedies, Dramas, International Movies","A gifted young singer becomes an instant sensation on a popular talent show. But her real goal is earning the love of her father, a member of the jury."
ax98_fgh_605e1e3f3099b600a6ab50fb,PAID,mp4,video,2021-03-30,image/diy/fedea445-2158-4dca-b403-c82455c016f1,image/diy/fedea445-2158-4dca-b403-c82455c016f1,image/diy/fedea445-2158-4dca-b403-c82455c016f1,LIVE,Movie,The Dirty Picture,Milan Luthria,,India,2011,TV-14,145 min,"Comedies, Dramas, International Movies","After running away from home in search of movie stardom, a village girl rises to become a prominent sex symbol."
ax98_fgh_61714472628fb500adc286bf,PAID,mp4,video,2021-11-07,image/diy/f623819a-c725-4f5b-88f4-90438f93932d,image/diy/f623819a-c725-4f5b-88f4-90438f93932d,image/diy/f623819a-c725-4f5b-88f4-90438f93932d,RELEGATED,Movie,The Haunting in Connecticut 2: Ghosts of Georgia,Tom Elkins,,United States,2013,R,101 min,Horror Movies,A couple's Georgia dream home becomes a living nightmare when their daughter begins to have frightening visions from the property's terrible past.
