content_id,accesslevel,contentformat,contenttype,date_added,imagedetails_heroimage,imagedetails_thumbnailimage,imagedetails_todayimage,status,type,title,director,cast,country,release_year,rating,duration,listed_in,description
ax98_fgh_5feabaec24d7c10091ef97bc,PAID,mp4,video,2021-02-10,image/diy/2f661e75-04dc-4209-9ec2-c7a84880e431,image/diy/2f661e75-04dc-4209-9ec2-c7a84880e431,image/diy/2f661e75-04dc-4209-9ec2-c7a84880e431,LIVE,Movie,Motu Patlu in Wonderland,Suhas Kadav,,,2013,TV-Y7,76 min,"Children & Family Movies, Music & Musicals","When pals Motu and Patlu take a ride in their scientist friend’s newly built plane, a crash-landing on a strange island leads to action and adventure."
ax98_fgh_60c0fd4da81af700988d58f6,FREE,mp4,video,2021-07-02,image/diy/33dc2610-275a-4296-b7a6-5d9a991d4235,image/diy/33dc2610-275a-4296-b7a6-5d9a991d4235,image/diy/33dc2610-275a-4296-b7a6-5d9a991d4235,RELEGATED,Movie,American Outlaws,Les Mayfield,,United States,2001,PG-13,94 min,Action & Adventure,"In the wake of the Civil War, Jesse James leads a feisty group of ranchers in a fight against a railroad baron bent on seizing their land at any cost."
ax98_fgh_6166bd49fa2bdc00a61ee977,PAID,mp4,video,2021-10-22,image/diy/9bb0c61e-5587-4693-8374-d6dd05fb813f,image/diy/9bb0c61e-5587-4693-8374-d6dd05fb813f,image/diy/9bb0c61e-5587-4693-8374-d6dd05fb813f,LIVE,Movie,A Very Country Christmas,Justin G. Dyck,,"United States, Canada",2017,TV-G,84 min,"Music & Musicals, Romantic Movies","When an unfulfilled country music star hides out in his hometown, he meets a budding interior designer who finds her way into his heart."
ax98_fgh_6163480ae66a9100a626bd26,PAID,mp4,video,2021-10-14,image/diy/c9b3220e-1de1-4629-b4e5-321f72d84473,image/diy/c9b3220e-1de1-4629-b4e5-321f72d84473,image/diy/c9b3220e-1de1-4629-b4e5-321f72d84473,LIVE,Movie,Chhota Bheem And The Crown of Valhalla,Rajiv Chilaka,,,2013,TV-Y7,64 min,Children & Family Movies,"To save the kingdom of Valhalla from invasion by Vikings, Bheem is gathering his army of friends, who are ready to put up a formidable fight!"
ax98_fgh_6156d584c0957200d038c1fc,PAID,mp4,video,2021-10-04,image/diy/b267d205-d749-47fc-a27c-48dd9e0cb6bf,image/diy/b267d205-d749-47fc-a27c-48dd9e0cb6bf,image/diy/b267d205-d749-47fc-a27c-48dd9e0cb6bf,LIVE,Movie,Uppena,Buchi Babu Sana,,India,2021,TV-14,145 min,"Dramas, International Movies, Romantic Movies","The son of a fishing community falls for a village head's daughter, but they face violent opposition from the girl’s doggedly old-fashioned father."
ax98_fgh_610677faff182200a731a9bd,PAID,mp4,video,2021-08-15,image/diy/5d430819-4119-47cf-ada0-429a3ffc022e,image/diy/5d430819-4119-47cf-ada0-429a3ffc022e,image/diy/5d430819-4119-47cf-ada0-429a3ffc022e,LIVE,Movie,Isi & Ossi,Oliver Kienle,,Germany,2021,TV-MA,113 min,"Comedies, International Movies, Romantic Movies",A billionaire's daughter fakes a relationship with a cash-strapped boxer in order to coerce her parents into letting her pursue her culinary dreams.
ax98_fgh_612d1e862ff8870092b6e9ee,PAID,mp4,video,2021-09-02,image/diy/2260d666-e040-4ca0-b722-aec20b97013f,image/diy/2260d666-e040-4ca0-b722-aec20b97013f,image/diy/2260d666-e040-4ca0-b722-aec20b97013f,LIVE,Movie,Adú,Salvador Calvo,,Spain,2021,TV-MA,120 min,"Dramas, International Movies","Near a Spanish town in northern Africa, a child takes a painful journey, a father reconnects with his daughter and a coast guard is guilt stricken."
ax98_fgh_6197e4c350cf2800bbc2bfc0,PAID,mp4,video,2021-11-25,image/diy/ca6b2ec9-818e-4c9f-8511-4e730a874991,image/diy/ca6b2ec9-818e-4c9f-8511-4e730a874991,image/diy/ca6b2ec9-818e-4c9f-8511-4e730a874991,DRAFT,Movie,Takers,John Luessenhop,,United States,2010,PG-13,107 min,Action & Adventure,An elite crew of bank robbers sets up a daring heist after a former associate persuades them to target an armored car that could be their biggest score.
ax98_fgh_5eddf1a3c908310091bcc109,PAID,mp4,video,2021-02-04,image/diy/df0aba44-cb93-4c1a-bb5b-360696191759,image/diy/df0aba44-cb93-4c1a-bb5b-360696191759,image/diy/df0aba44-cb93-4c1a-bb5b-360696191759,LIVE,Movie,Ankahi Kahaniya,"Ashwiny Iyer Tiwari, Abhishek Chaubey, Saket Chaudhary",,,2021,TV-14,111 min,"Dramas, Independent Movies, International Movies","As big city life buzzes around them, lonely souls discover surprising sources of connection and companionship in three tales of love, loss and longing."
ax98_fgh_5fc1409835886200eb725bcf,FREE,mp4,video,2021-02-09,image/diy/7803732a-b3ba-47c2-9fad-aaa6327f520a,image/diy/7803732a-b3ba-47c2-9fad-aaa6327f520a,image/diy/7803732a-b3ba-47c2-9fad-aaa6327f520a,LIVE,Movie,Out of my league,Alice Filippi,,,2021,TV-MA,92 min,"Comedies, Dramas, International Movies","Tired of swiping through the dating scene with her besties in tow, a charming yet awkward woman with a rare genetic disorder sets her sights on love."
ax98_fgh_611bea2138423e00a241d0e3,PAID,mp4,video,2021-08-21,image/diy/e1c9331f-26e2-42cb-baa2-01564fdc1c97,image/diy/e1c9331f-26e2-42cb-baa2-01564fdc1c97,image/diy/e1c9331f-26e2-42cb-baa2-01564fdc1c97,LIVE,Movie,Audrey,Helena Coan,,,2021,TV-14,101 min,Documentaries,"An intimate portrait of legendary Hollywood actress, fashion icon and humanitarian Audrey Hepburn, who stood for love above all else."
ax98_fgh_616574ea71e74900a6be4b89,PAID,mp4,video,2021-10-16,image/diy/4108a457-b4cb-414e-9412-4e147a955db0,image/diy/4108a457-b4cb-414e-9412-4e147a955db0,image/diy/4108a457-b4cb-414e-9412-4e147a955db0,LIVE,Movie,Five Feet Apart,Justin Baldoni,,United States,2019,PG-13,116 min,"Dramas, Romantic Movies",A teen with cystic fibrosis shakes up her daily routine and challenges hospital protocol when she falls for a fellow patient.
ax98_fgh_60fa9f8207159700c2caa40b,FREE,mp4,video,2021-09-16,image/diy/569db6e2-0574-4e5e-b7ef-70a62954a5d6,image/diy/569db6e2-0574-4e5e-b7ef-70a62954a5d6,image/diy/569db6e2-0574-4e5e-b7ef-70a62954a5d6,RELEGATED,Movie,Story of Kale: When Someone's in Love,Angga Dwimas Sasongko,,Indonesia,2021,TV-PG,78 min,"Dramas, International Movies, Romantic Movies","After leaving a toxic relationship, Dinda embarks on a romance with Kale, whose view on love soon shatters as he wrestles with his own insecurities."
ax98_fgh_6097dd2621dca41f09e41e5e,PAID,mp4,video,2021-05-12,image/diy/f3ab2caa-cb2c-4bb2-82ad-1cb74b033c90,image/diy/f3ab2caa-cb2c-4bb2-82ad-1cb74b033c90,image/diy/f3ab2caa-cb2c-4bb2-82ad-1cb74b033c90,LIVE,Movie,Guest House,Sam Macaroni,,United States,2021,R,84 min,Comedies,The only downside to a young couple’s new dream home — and fresh start — is the nightmare of the raucous houseguest in back who refuses to leave.
ax98_fgh_609a85df8ea1ba00d81aee40,FREE,mp4,video,2021-05-17,image/diy/76c06657-864d-4554-b344-5b5aa1367ceb,image/diy/76c06657-864d-4554-b344-5b5aa1367ceb,image/diy/76c06657-864d-4554-b344-5b5aa1367ceb,RELEGATED,Movie,Ojukokoro: Greed,Dare Olaitan,,Nigeria,2016,TV-MA,108 min,"Dramas, International Movies, Thrillers","Down and out of luck, the manager of a shady gas station gets in over his head when he tries to steal from his grubby employers."
ax98_fgh_5ff72bc813e387673ba83c4b,PAID,mp4,video,2021-01-12,image/diy/5597e76a-419e-4f65-b40e-e354e3460599,image/diy/6cd49bb9-ba2b-43e1-97f5-887ece04cf54,image/diy/f07a6ea6-9d00-4894-b745-c0fab95ed4b9,LIVE,Movie,Pagpag: Nine Lives,Frasco Mortiz,,Philippines,2013,TV-14,106 min,"Horror Movies, International Movies","After ignoring superstitions, a group of teenagers find themselves in a fight for their lives when they are haunted — and hunted — by an evil spirit."
ax98_fgh_60a3a8384c512c009f0d0b41,PAID,mp4,video,2021-05-21,image/diy/b0249a9a-ae5e-4501-81ed-f6a077a54fd4,image/diy/b0249a9a-ae5e-4501-81ed-f6a077a54fd4,image/diy/b0249a9a-ae5e-4501-81ed-f6a077a54fd4,LIVE,Movie,Wave of Cinema: Surat dari Timur,Saron Sakina,,,2021,TV-G,58 min,"Documentaries, International Movies, Music & Musicals","Featuring a mix of film footage and special performances, this virtual concert honors the memory and music of revered Indonesian singer Glenn Fredly."
ax98_fgh_605ee2ebf0156e00f3600149,PAID,mp4,video,2021-04-09,image/diy/b572409e-b0ee-4e83-a6ab-636ec7414df7,image/diy/b572409e-b0ee-4e83-a6ab-636ec7414df7,image/diy/b572409e-b0ee-4e83-a6ab-636ec7414df7,DRAFT,Movie,The Occupant,"Àlex Pastor, David Pastor",,Spain,2021,TV-MA,104 min,"Independent Movies, International Movies, Thrillers",An unemployed advertising executive begins stalking the new tenants of his former home and his motives toward the family turn sinister.
ax98_fgh_6175c332894db80092f34a5d,PAID,mp4,video,2021-10-28,image/diy/9e7abf24-1889-45e0-840b-709fed96708f,image/diy/9e7abf24-1889-45e0-840b-709fed96708f,image/diy/9e7abf24-1889-45e0-840b-709fed96708f,LIVE,Movie,"Yes, God, Yes",Karen Maine,,United States,2021,R,78 min,"Comedies, Dramas, Independent Movies","A devoutly religious teen grapples with her own sexual awakening, and attends a Catholic school retreat in the hopes of suppressing her newfound urges."
ax98_fgh_5f81a2fc02cfdc00d63e7465,PAID,mp4,video,2021-01-26,image/diy/403bc007-1a7f-4ba1-99d4-e5d7c2a4b858,image/diy/403bc007-1a7f-4ba1-99d4-e5d7c2a4b858,image/diy/403bc007-1a7f-4ba1-99d4-e5d7c2a4b858,LIVE,Movie,A Christmas Catch,,,Canada,2018,TV-G,87 min,"Dramas, Romantic Movies",A cop working undercover to trail a possible diamond thief gets caught in a tricky spot when she finds new clues — and new feelings — for the suspect.
ax98_fgh_60474ce107d86d0098634a48,PAID,mp4,video,2021-05-05,image/diy/5f0320d9-426f-4faa-89bc-5dad90cbeef2,image/diy/5f0320d9-426f-4faa-89bc-5dad90cbeef2,image/diy/5f0320d9-426f-4faa-89bc-5dad90cbeef2,LIVE,Movie,Motu Patlu in Octupus World,Suhas Kadav,,,2017,TV-Y,81 min,"Children & Family Movies, Comedies","While returning a goldfish and an octopus from an aquarium to the sea, Motu and Patlu must also save the goldfish’s family from a mean, tentacled queen."
ax98_fgh_607b04357e06e700bbaa314b,PAID,mp4,video,2021-04-20,image/diy/fc14cde8-6130-4414-afb4-fd81ec8af437,image/diy/fc14cde8-6130-4414-afb4-fd81ec8af437,image/diy/fc14cde8-6130-4414-afb4-fd81ec8af437,LIVE,Movie,Hometown Holiday,Justin G. Dyck,,Canada,2018,TV-G,84 min,Romantic Movies,"An ambitious entertainment lawyer tries to sign a singing sensation in his sister's small town, but a local soon captures his attention — and heart."
ax98_fgh_61740961dd69c800ad2366c4,PAID,mp4,video,2021-10-28,image/diy/de56c2da-690d-4945-a62e-c8c7f7916681,image/diy/de56c2da-690d-4945-a62e-c8c7f7916681,image/diy/de56c2da-690d-4945-a62e-c8c7f7916681,RELEGATED,Movie,Boyka: Undisputed,Todor Chapkanov,,"Bulgaria, United States",2016,R,90 min,Action & Adventure,The fourth film in the action franchise finds Boyka taking on brutal gangsters to protect the widow of a man he unintentionally killed in the ring.
ax98_fgh_616fd6758d288600de4a9830,PAID,mp4,video,2021-10-30,image/diy/c99a19de-d7ce-4ebf-83de-3dae1bbca835,image/diy/c99a19de-d7ce-4ebf-83de-3dae1bbca835,image/diy/c99a19de-d7ce-4ebf-83de-3dae1bbca835,LIVE,Movie,EMI: Liya Hai To Chukana Padega,Saurabh Kabra,,India,2008,TV-14,128 min,"Comedies, Dramas, International Movies",A bank hires an enigmatic and unorthodox debt collector to recover money from four borrowers who are unable to pay their loans.
ax98_fgh_60aa800a752a3100a6957b40,PAID,mp4,video,2021-09-06,image/diy/82960b82-9573-4e4b-9860-72307e29eba0,image/diy/82960b82-9573-4e4b-9860-72307e29eba0,image/diy/82960b82-9573-4e4b-9860-72307e29eba0,LIVE,Movie,Seaspiracy,Ali Tabrizi,,United States,2021,TV-14,90 min,Documentaries,"Passionate about ocean life, a filmmaker sets out to document the harm that humans do to marine species — and uncovers alarming global corruption."
ax98_fgh_616696468d9ab4009f0f31e0,PAID,mp4,video,2021-10-21,image/diy/8ee041aa-4bd7-4b81-901c-f679f21ad969,image/diy/8ee041aa-4bd7-4b81-901c-f679f21ad969,image/diy/8ee041aa-4bd7-4b81-901c-f679f21ad969,LIVE,Movie,Outside the Wire,Mikael Håfström,,"Hungary, United States",2021,R,116 min,Action & Adventure,"In the near future, a drone pilot sent into a war zone finds himself paired with a top-secret android officer on a mission to stop a nuclear attack."
ax98_fgh_5fa414447fabbe00f5689db8,PAID,mp4,video,2021-05-10,image/diy/7e054250-f6fb-4d4e-8521-545d8ee3b23b,image/diy/7e054250-f6fb-4d4e-8521-545d8ee3b23b,image/diy/7e054250-f6fb-4d4e-8521-545d8ee3b23b,LIVE,Movie,The House of Flowers: The Movie,Manolo Caro,,,2021,TV-MA,88 min,"Comedies, International Movies, Music & Musicals",The De La Mora siblings concoct a mischievous plan to break into their old family home to retrieve a hidden treasure of significant importance.
ax98_fgh_5fa414447fabbe00f5689db8,PAID,mp4,video,2021-05-07,image/diy/7e054250-f6fb-4d4e-8521-545d8ee3b23b,image/diy/7e054250-f6fb-4d4e-8521-545d8ee3b23b,image/diy/7e054250-f6fb-4d4e-8521-545d8ee3b23b,DRAFT,Movie,The Match,Francesco Carnesecchi,,Italy,2021,TV-MA,97 min,"Dramas, International Movies, Sports Movies","One football match on a dirt pitch near Rome becomes a day of reckoning as a young player, his coach and their team's owner wrestle internal demons."
ax98_fgh_619772a118b39400b0802678,PAID,mp4,video,2021-11-26,image/diy/1bc5121b-2db6-4b9f-99d1-b5248289010b,image/diy/1bc5121b-2db6-4b9f-99d1-b5248289010b,image/diy/1bc5121b-2db6-4b9f-99d1-b5248289010b,RELEGATED,Movie,Lagaan,Ashutosh Gowariker,,"India, United Kingdom",2001,PG,224 min,"Dramas, International Movies, Music & Musicals","In 1890s India, an arrogant British commander challenges the harshly taxed residents of Champaner to a high-stakes cricket match."
ax98_fgh_61a1df224ee90a00bb1151d7,PAID,mp4,video,2021-12-01,image/diy/0f07be5e-f551-4fe9-9f30-b0a44c02f1b5,image/diy/0f07be5e-f551-4fe9-9f30-b0a44c02f1b5,image/diy/0f07be5e-f551-4fe9-9f30-b0a44c02f1b5,RELEGATED,Movie,Radium Girls,"Lydia Dean Pilcher, Ginny Mohler",,United States,2018,TV-14,103 min,"Dramas, Independent Movies","When the women at a radium factory begin to fall gravely and inexplicably ill, Bessie and her co-workers set out to expose a corporate cover-up."
ax98_fgh_608d8785b174f100df223868,PAID,mp4,video,2021-05-05,image/diy/11625fc2-df85-4796-a1f4-ae3317140204,image/diy/11625fc2-df85-4796-a1f4-ae3317140204,image/diy/11625fc2-df85-4796-a1f4-ae3317140204,LIVE,Movie,Ghost Lab,Paween Purijitpanya,,Thailand,2021,TV-MA,118 min,"Horror Movies, International Movies, Thrillers","After witnessing a haunting in their hospital, two doctors become dangerously obsessed with obtaining scientific proof that ghosts exist."
ax98_fgh_605cd380e9cbaa00d7f8fc98,PAID,mp4,video,2021-05-07,image/diy/7b195030-5822-415d-8525-56d8f9cd6102,image/diy/7b195030-5822-415d-8525-56d8f9cd6102,image/diy/7b195030-5822-415d-8525-56d8f9cd6102,LIVE,Movie,Truckbhar Swapna,Pramod Pawar,,India,2018,TV-14,128 min,"Comedies, Dramas, International Movies",A taxi driver living in a Mumbai slum seeks to better his family's life by building an extension of his home while dealing with a lecherous contractor.
ax98_fgh_606afe12cae6c200ad1b9d1e,PAID,mp4,video,2021-05-05,image/diy/fe29ec59-83b9-43cf-ba9a-484545d1ea9b,image/diy/fe29ec59-83b9-43cf-ba9a-484545d1ea9b,image/diy/fe29ec59-83b9-43cf-ba9a-484545d1ea9b,RELEGATED,Movie,John Was Trying to Contact Aliens,,,United States,2021,TV-PG,17 min,"Documentaries, LGBTQ Movies","A rural electronics whiz broadcasts radio signals into space and monitors for signs of aliens, but makes a more important connection here on Earth."
ax98_fgh_6021494642fa2c09cddff732,PAID,mp4,video,2021-05-05,image/diy/ff3f9fd2-7283-490b-a5b4-1068cbbcc428,image/diy/ff3f9fd2-7283-490b-a5b4-1068cbbcc428,image/diy/ff3f9fd2-7283-490b-a5b4-1068cbbcc428,LIVE,Movie,Peepli Live,"Anusha Rizvi, Mahmood Farooqui",,India,2010,TV-MA,109 min,"Comedies, Dramas, Independent Movies",Two indigent farmers consider suicide so that their families can collect a government subsidy that's paid to the relatives of deceased farmers.
ax98_fgh_60f168844bff8a00d125cbed,PAID,mp4,video,2021-08-23,image/diy/94c1866e-ab38-4e19-968f-5b3197fb0a01,image/diy/94c1866e-ab38-4e19-968f-5b3197fb0a01,image/diy/94c1866e-ab38-4e19-968f-5b3197fb0a01,LIVE,Movie,Made You Look: A True Story About Fake Art,Barry Avrich,,Canada,2021,TV-14,90 min,"Documentaries, International Movies","A woman walks into a New York gallery with a cache of unknown masterworks. Thus begins a story of art world greed, willfulness and a high-stakes con."
ax98_fgh_616573f8de77250092c760f8,PAID,mp4,video,2021-10-16,image/diy/4a59cb9f-26a7-436c-b223-28513fe6565b,image/diy/4a59cb9f-26a7-436c-b223-28513fe6565b,image/diy/4a59cb9f-26a7-436c-b223-28513fe6565b,LIVE,Movie,Aelay,Halitha Shameem,,India,2021,TV-14,151 min,"Comedies, Dramas, Independent Movies","A son stoically returns to his village upon his father’s death, recalling their chilly dynamic before a bizarre event disrupts his visit."
ax98_fgh_606d5d57f46dc500923bc820,FREE,mp4,video,2021-05-07,image/diy/e7138a0c-4c43-4ebb-8d4a-1e37a56ce1c9,image/diy/e7138a0c-4c43-4ebb-8d4a-1e37a56ce1c9,image/diy/e7138a0c-4c43-4ebb-8d4a-1e37a56ce1c9,LIVE,Movie,The Kissing Booth 2,Vince Marcello,,"United Kingdom, United States",2021,TV-14,133 min,"Comedies, Romantic Movies","With college decisions looming, Elle juggles her long-distance romance with Noah, changing relationship with bestie Lee and feelings for a new classmate."
ax98_fgh_6183b5f554f18600b54b21be,PAID,mp4,video,2021-11-11,image/diy/81a4bb1c-59e6-4c9e-9d9f-bba514075781,image/diy/81a4bb1c-59e6-4c9e-9d9f-bba514075781,image/diy/81a4bb1c-59e6-4c9e-9d9f-bba514075781,RELEGATED,Movie,Ginny Weds Sunny,Puneet Khanna,,India,2021,TV-MA,126 min,"Comedies, International Movies, Romantic Movies","Eager to marry but constantly rejected by women, a bachelor hopes to win over a former crush by accepting help from an unlikely source: her mother."
ax98_fgh_61818125c2804400c2098162,PAID,mp4,video,2021-11-04,image/diy/dc7d23a5-0092-4972-9784-8d16052aee77,image/diy/dc7d23a5-0092-4972-9784-8d16052aee77,image/diy/dc7d23a5-0092-4972-9784-8d16052aee77,RELEGATED,Movie,Naruto the Movie 2: Legend of the Stone of Gelel,Hirotsugu Kawasaki,,Japan,2005,TV-PG,97 min,"Action & Adventure, Anime Features, International Movies","While on a mission to return a missing pet, Naruto and two fellow ninjas are ambushed by brutal knights led by the enigmatic Temujin."
ax98_fgh_618801d2cb3a47009853675a,PAID,mp4,video,2021-11-13,image/diy/edfb4a26-5e95-449c-9eaf-b5999791d96e,image/diy/edfb4a26-5e95-449c-9eaf-b5999791d96e,image/diy/edfb4a26-5e95-449c-9eaf-b5999791d96e,LIVE,Movie,Brother Jekwu,Charles Uwagbai,,Nigeria,2016,TV-14,101 min,"Comedies, International Movies","Chasing wild success, a village hustler follows his cousin from Nigeria to Kenya and stumbles into the shady business affairs of a notorious overlord."
ax98_fgh_60f44b9d33666e00b55af7b3,PAID,mp4,video,2021-08-30,image/diy/f623819a-c725-4f5b-88f4-90438f93932d,image/diy/f623819a-c725-4f5b-88f4-90438f93932d,image/diy/f623819a-c725-4f5b-88f4-90438f93932d,LIVE,Movie,Lowriders,Ricardo de Montreuil,,United States,2016,PG-13,98 min,"Dramas, Independent Movies","Caught up in the lowrider world of his father and embittered brother, an East LA graffiti artist grapples with a family feud while chasing his dreams."
ax98_fgh_60952b3443339c0d1727b2dd,PAID,mp4,video,2021-05-10,image/diy/c7765308-7ee1-4139-a9f9-0d66cda90f8f,image/diy/c7765308-7ee1-4139-a9f9-0d66cda90f8f,image/diy/c7765308-7ee1-4139-a9f9-0d66cda90f8f,LIVE,Movie,Three Words to Forever,Cathy Garcia-Molina,,Philippines,2018,TV-G,107 min,"Comedies, Dramas, International Movies","As they near their 25th wedding anniversary, Rick and Cristy try to conceal their crumbling marriage while their family prepares for a big celebration."
ax98_fgh_615886e9b584a3009f0ce795,PAID,mp4,video,2021-10-04,image/diy/2d74bc0b-2558-42ec-a766-17088c5fbff3,image/diy/2d74bc0b-2558-42ec-a766-17088c5fbff3,image/diy/2d74bc0b-2558-42ec-a766-17088c5fbff3,RELEGATED,Movie,Gurgaon,Shanker Raman,,India,2017,TV-14,106 min,"Dramas, International Movies, Thrillers","When the daughter of a wealthy family returns from college, she gets a frosty welcome from her brother, who has problems – and plans – of his own."
ax98_fgh_614f357394744d0093a225cb,PAID,mp4,video,2021-09-28,image/diy/2f0a048d-d0ab-43f6-ade8-787d3c93113c,image/diy/2f0a048d-d0ab-43f6-ade8-787d3c93113c,image/diy/2f0a048d-d0ab-43f6-ade8-787d3c93113c,LIVE,Movie,Mutiny of the Worker Bees,Carlos Morett,,Mexico,2021,TV-MA,94 min,"Comedies, International Movies","When Omar's grandfather forces him to get a job at a tech company in Mexico City, he meets a quirky ensemble of nine-to-fivers ... and some nemeses."
ax98_fgh_603d156e16aab60099800aa7,PAID,mp4,video,2021-03-01,image/diy/0c22f976-797d-4365-bc3f-7e48155f105b,image/diy/0c22f976-797d-4365-bc3f-7e48155f105b,image/diy/0c22f976-797d-4365-bc3f-7e48155f105b,LIVE,Movie,Worth,Sara Colangelo,,,2021,PG-13,119 min,Dramas,"In the wake of the Sept. 11 attacks, a lawyer faces an emotional reckoning as he attempts to put a dollar value on the lives lost. Based on real events."
ax98_fgh_615f2285d7fad600df41752e,PAID,mp4,video,2021-10-13,image/diy/d4b2a39c-8f3e-4c6e-98b2-d18654da5416,image/diy/d4b2a39c-8f3e-4c6e-98b2-d18654da5416,image/diy/d4b2a39c-8f3e-4c6e-98b2-d18654da5416,LIVE,Movie,The Secret Diary of an Exchange Student,Bruno Garotti,,,2021,TV-14,97 min,"Comedies, International Movies, Romantic Movies","Looking to shake things up, two best friends embark on a life-changing adventure abroad as exchange students. But can they stay out of trouble?"
ax98_fgh_600e5a42fe044800a657b32e,PAID,mp4,video,2021-01-28,image/diy/e7cc62e8-10a4-49e1-9af5-46d7a71f192b,image/diy/e7cc62e8-10a4-49e1-9af5-46d7a71f192b,image/diy/e7cc62e8-10a4-49e1-9af5-46d7a71f192b,RELEGATED,Movie,One Take,Manatsanun Phanlerdwongsakul,,Thailand,2021,TV-G,86 min,"Documentaries, International Movies, Music & Musicals",Members of Thai girl group BNK48 share the ups and downs of preparing for the 6th Single Senbatsu General Election.
ax98_fgh_61010a383337a1009a7dae1e,PAID,mp4,video,2021-09-07,image/diy/464e0ad0-2839-4120-8b50-c1270eee81c8,image/diy/464e0ad0-2839-4120-8b50-c1270eee81c8,image/diy/464e0ad0-2839-4120-8b50-c1270eee81c8,LIVE,Movie,Naruto Shippuden the Movie: Blood Prison,Masahiko Murata,,Japan,2011,TV-14,102 min,"Action & Adventure, Anime Features, International Movies","Mistakenly accused of an attack on the Fourth Raikage, ninja Naruto is imprisoned in the impenetrable Hozuki Castle and his powers are sealed."
ax98_fgh_6171a39783d98300ada94702,PAID,mp4,video,2021-10-26,image/diy/9f94480c-f3ba-40de-853f-1855e889c90c,image/diy/9f94480c-f3ba-40de-853f-1855e889c90c,image/diy/9f94480c-f3ba-40de-853f-1855e889c90c,LIVE,Movie,The Edge of Seventeen,Kelly Fremon Craig,,"United States, China",2016,R,105 min,"Comedies, Dramas",A troubled teenager finds high school life even less bearable after she catches her childhood best friend hooking up with her popular older brother.
ax98_fgh_60ab9c80e26c360092cb4716,PAID,mp4,video,2021-09-06,image/diy/4b5cfd06-212f-498d-beab-99d0d99b1784,image/diy/4b5cfd06-212f-498d-beab-99d0d99b1784,image/diy/4b5cfd06-212f-498d-beab-99d0d99b1784,LIVE,Movie,Fatima,Marco Pontecorvo,,"Portugal, United States",2021,PG-13,113 min,"Dramas, Faith & Spirituality","In 1917 Portugal, visions of the Virgin Mary come to three children whose message of faith raises doubts in their family and angers authorities."
ax98_fgh_60c3900564133500929d93f7,PAID,mp4,video,2021-08-21,image/diy/603d4041-f618-4d43-97fd-9e43942fb180,image/diy/603d4041-f618-4d43-97fd-9e43942fb180,image/diy/603d4041-f618-4d43-97fd-9e43942fb180,LIVE,Movie,What We Wanted,Ulrike Kofler,,Austria,2021,TV-MA,93 min,"Dramas, International Movies",A couple facing fertility issues finds their marriage tested on a vacation to a Sardinian resort — and the family next door only adds to the tension.
ax98_fgh_610fcdb0df47d300930f6744,PAID,mp4,video,2021-08-12,image/diy/7a770c66-c937-4189-a9bb-5841c0c07079,image/diy/7a770c66-c937-4189-a9bb-5841c0c07079,image/diy/7a770c66-c937-4189-a9bb-5841c0c07079,LIVE,Movie,Surf's Up,"Ash Brannon, Chris Buck",,"United States, Canada",2007,PG,86 min,"Children & Family Movies, Comedies, Sports Movies",This Oscar-nominated animated comedy goes behind the scenes at the Penguin World Surfing Championship to get a close-up look at the inventors of surfing.
ax98_fgh_60352da0019fc800d860bb5a,PAID,mp4,video,2021-05-05,image/diy/81442f7a-38c5-44f7-8291-19df0196720a,image/diy/81442f7a-38c5-44f7-8291-19df0196720a,image/diy/81442f7a-38c5-44f7-8291-19df0196720a,LIVE,Movie,Motu Patlu: Deep Sea Adventure,Suhas Kadav,,,2014,TV-Y7,76 min,"Children & Family Movies, Comedies",Friends Motu and Patlu get more maritime excitement than anticipated when the sinking of their ship sends them on a journey through the ocean floor!
ax98_fgh_5ef60ba487b541009fcb766c,PAID,mp4,video,2021-05-31,image/diy/15f2ce8d-d1de-48b4-81f0-54dd0c3c5572,image/diy/15f2ce8d-d1de-48b4-81f0-54dd0c3c5572,image/diy/15f2ce8d-d1de-48b4-81f0-54dd0c3c5572,RELEGATED,Movie,Leyla Everlasting,,,Turkey,2021,TV-MA,113 min,"Comedies, International Movies","A resilient housewife, her husband and their marriage therapist become mired in a toxic love triangle and a plot to obtain an antique manuscript."
ax98_fgh_6095c619b1112a00bc3d4ad4,FREE,mp4,video,2021-05-12,image/diy/fc130614-56ed-4415-a746-e561820e5d6e,image/diy/04f51b6d-42a1-4a71-988d-248d557d6e7c,image/diy/01590c3b-8c4b-44e3-8d6e-38d01319490e,LIVE,Movie,Double Dad,Cris D'Amato,,Brazil,2021,TV-G,105 min,"Children & Family Movies, Comedies, Dramas","While her mom is away, a teen sneaks out of the hippie commune where she lives and embarks on a life-changing adventure to discover who her father is."
